title,authors,year,venue,doi,abstract,source_url,discovery_source,discovery_query,inclusion_path,citation_count,reference_count,affiliations,candidate_id,scored_at,is_preprint,venue_score,citation_score,institution_score,institution_bonus,relevance_score,total_quality_score,review_reason,recommended_action,harvest_source,rescore_run_id
What is the influence of a reduction of planktivorous and benthivorous fish on water quality in temperate eutrophic lakes? A systematic review,Claes Bernes; Stephen R Carpenter; Anna Gårdmark; Per Larsson; Lennart Persson; Christian Skov; James DM Speed; Ellen Van Donk,2015.0,Environmental Evidence,10.1186/s13750-015-0032-9,"Abstract Background In recent decades, many attempts have been made to restore eutrophic lakes through biomanipulation. Reducing the populations of planktivorous and benthivorous fish (either directly or through stocking of piscivorous fish) may induce ecosystem changes that increase water transparency and decrease the risk of algal blooms and fish kills, at least in the short term. However, the generality of biomanipulation effects on water quality across lake types and geographical regions is not known. Therefore, we have undertaken a systematic review of such effects in eutrophic lakes in temperate regions throughout the world. Methods Searches for literature were made using online publication databases, search engines, specialist websites and bibliographies of literature reviews. Search terms were developed in English, Danish, Dutch and Swedish. Identified articles were screened for relevance using inclusion criteria set out in an a priori protocol. To reduce the risk of bias, we then critically appraised the combined evidence found on each biomanipulation. Data were extracted on outcomes such as Secchi depth and chlorophyll a concentration before, during and/or after manipulation, and on effect modifiers such as lake properties and amounts of fish removed or stocked. Results Our searches identified more than 14,500 articles. After screening for relevance, 233 of them remained. After exclusions based on critical appraisal, our evidence base included useful data on 128 biomanipulations in 123 lakes. Of these interventions, 85% had been made in Europe and 15% in North America. Meta-analysis showed that removal of planktivores and benthivores (with or without piscivore stocking) leads to increased Secchi depth and decreased chlorophyll a concentration during intervention and the first three years afterwards. Piscivore stocking alone has no significant effect. The response of chlorophyll a levels to biomanipulation is stronger in lakes where fish removal is intense, and in lakes which are small and/or have high pre-manipulation concentrations of total phosphorus. Conclusions Our review improves on previous reviews of biomanipulation in that we identified a large number of case studies from many parts of the world and used a consistent, repeatable process to screen them for relevance and susceptibility to bias. Our results indicate that removal of planktivorous and benthivorous fish is a useful means of improving water quality in eutrophic lakes. Biomanipulation tends to be particularly successful in relatively small lakes with short retention times and high phosphorus levels. More thorough fish removal increases the efficacy of biomanipulation. Nonetheless successes and failures have occurred across a wide range of conditions.",https://doi.org/10.1186/s13750-015-0032-9,Semantic Scholar citation chain,The Role of Google Scholar in Evidence Reviews and Its Applicability to Grey Literature Searching,backward chaining,95.0,0.0,,6866,2026-04-28T00:06:36.923524+00:00,False,40.0,98.9,20.0,0.0,37.5,62.93,,auto-include,Crossref DOI,54d0819ceb5d42939ac9f123427bed6e
What are ‘Integrated Landscape Approaches’ and how effectively have they been implemented in the tropics: a systematic map protocol,James Reed; Liz Deakin; Terry Sunderland,2015.0,Environmental Evidence,10.1186/2047-2382-4-2,"BackgroundThere is an increasing acceptance that sectorial approaches to land management are no longer sufficient to meet global challenges such as poverty alleviation, biodiversity conservation, and food production. The pressing challenge of integrated landscape management is to link agricultural practices, institutions and policies with other landscape-scale activities. “Integrated Landscape Approaches” provide a basic framework for balancing competing demands and integrating policies for multiple land uses within a given area. However, attempts to formalize and characterize what landscape approaches actually represent have resulted in a plethora of interlinked terminology and re-invention of ideas and practices under multiple guises. This has led to delayed uptake amongst policy makers and resistance to implementation on the ground. This protocol will describe the methodology to be employed for a systematic map that will chart the development of the landscape approach theory, consolidate and synthesize existing definitions, and identify where and how these approaches have been implemented in the humid and dry tropics.Methods/DesignA scoping exercise gave rise to a selection of search terms appropriate to the research question which will then be applied to a suite of specialist, online and institutional databases. The protocol will follow a population-intervention-comparator-outcome (P.I.C.O) framework which provides the basic rationale for evidence-based systematic literature searches. The P.I.C.O serves as the inclusion criteria and together with a pre-determined exclusion criteria will be used to screen retrieved literature for relevance at title, abstract and full text levels. All studies investigating either landscape approach theory or implementation within the humid and dry tropics will be included. The resulting studies will be coded and used to satisfy two key outcomes. First, literature on the theory of landscape-scale approaches will be compared and contrasted to identify where overlap and disjuncture exists. Second, studies of landscape approach implementation will be assessed for effectiveness, geographically mapped, made available in searchable databases and supplemented with a full report.",https://doi.org/10.1186/2047-2382-4-2,Semantic Scholar citation chain,The Role of Google Scholar in Evidence Reviews and Its Applicability to Grey Literature Searching,backward chaining,150.0,0.0,,6867,2026-04-28T00:06:36.923524+00:00,False,40.0,100.0,20.0,0.0,50.0,66.5,,auto-include,Crossref DOI,54d0819ceb5d42939ac9f123427bed6e
"Advanced Persistent Threat Attack Detection Systems: A Review of Approaches, Challenges, and Trends",Robin Buchta; George Gkoktsis; Felix Heine; Carsten Kleiner,2024.0,Digital Threats: Research and Practice,10.1145/3696014,"Advanced persistent threat (APT) attacks present a significant challenge for any organization, as they are difficult to detect due to their elusive nature and characteristics. In this article, we conduct a comprehensive literature review to investigate the various APT attack detection systems and approaches and classify them based on their threat model and detection method. Our findings reveal common obstacles in APT attack detection, such as correctly attributing anomalous behavior to APT attack activities, limited availability of public datasets and inadequate evaluation methods, challenges with detection procedures, and misinterpretation of requirements. Based on our findings, we propose a reference architecture to enhance the comparability of existing systems and provide a framework for classifying detection systems. In addition, we look in detail at the problems encountered in current evaluations and other scientific gaps, such as a neglected consideration of integrating the systems into existing security architectures and their adaptability and durability. While no one-size-fits-all solution exists for APT attack detection, this review shows that graph-based approaches hold promising potential. However, further research is required for real-world usability, considering the systems’ adaptability and explainability.",https://doi.org/10.1145/3696014,Semantic Scholar citation chain,"A Survey on Advanced Persistent Threats: Techniques, Solutions, Challenges, and Research Opportunities",backward chaining,26.0,0.0,,6872,2026-04-28T00:06:36.923524+00:00,False,40.0,71.41,20.0,0.0,75.0,61.32,,auto-include,Crossref DOI,54d0819ceb5d42939ac9f123427bed6e
"Identifying Authorship in Malicious Binaries: Features, Challenges & Datasets",Jason Gray; Daniele Sgandurra; Lorenzo Cavallaro; Jorge Blasco Alis,2024.0,ACM Computing Surveys,10.1145/3653973,"Attributing a piece of malware to its creator typically requires threat intelligence. Binary attribution increases the level of difficulty as it mostly relies upon the ability to disassemble binaries to obtain authorship-related features. We perform a systematic analysis of works in the area of malware authorship attribution. We identify key findings and some shortcomings of current approaches and explore the open research challenges. To mitigate the lack of ground-truth datasets in this domain, we publish alongside this survey the largest and most diverse meta-information dataset of 17,513 malware labeled to 275 threat actor groups.",https://doi.org/10.1145/3653973,Semantic Scholar citation chain,"A Survey on Advanced Persistent Threats: Techniques, Solutions, Challenges, and Research Opportunities",backward chaining,14.0,0.0,,6874,2026-04-28T00:06:36.923524+00:00,False,100.0,58.68,20.0,0.0,50.0,70.97,,auto-include,Crossref DOI,54d0819ceb5d42939ac9f123427bed6e
Big Data Storage,Martin Strohbach; Jörg Daubert; Herman Ravkin; Mario Lischka,2021.0,New Horizons for a Data-Driven Economy,10.1007/978-3-319-21569-3_7,"This chapter provides an overview of big data storage technologies. It is the result of a survey of the current state of the art in data storage technologies in order to create a cross-sectorial technology roadmap. This chapter provides a concise overview of big data storage systems that are capable of dealing with high velocity, high volumes, and high varieties of data. It describes distributed file systems, NoSQL databases, graph databases, and NewSQL databases. The chapter investigates the challenge of storing data in a secure and privacy-preserving way. The social and economic impact of big data storage technologies is described, open research challenges highlighted, and three selected case studies are provided from the health, finance, and energy sector. Some of the key insights on big data storage are (1) in-memory databases and columnar databases typically outperform traditional relational database systems, (2) the major technical barrier to widespread up-take of big data storage solutions are missing standards, and (3) there is a need to address open research challenges related to the scalability and performance of graph databases.",https://doi.org/10.1007/978-3-319-21569-3_7,Semantic Scholar citation chain,Big Data Analytics: A Survey,backward chaining,51.0,0.0,,6876,2026-04-28T00:06:36.923524+00:00,False,40.0,85.62,20.0,0.0,50.0,60.75,,auto-include,Crossref DOI,54d0819ceb5d42939ac9f123427bed6e
"Big data analytics in medical engineering and healthcare: methods, advances and challenges",Lidong Wang; Cheryl Ann Alexander,2020.0,Journal of Medical Engineering &amp; Technology,10.1080/03091902.2020.1769758,"Abstract Big data analytics are gaining popularity in medical engineering and healthcare use cases. Stakeholders are finding big data analytics reduce medical costs and personalise medical services for each individual patient. Big data analytics can be used in large-scale genetics studies, public health, personalised and precision medicine, new drug development, etc. The introduction of the types, sources, and features of big data in healthcare as well as the applications and benefits of big data and big data analytics in healthcare is key to understanding healthcare big data and will be discussed in this article. Major methods, platforms and tools of big data analytics in medical engineering and healthcare are also presented. Advances and technology progress of big data analytics in healthcare are introduced, which includes artificial intelligence (AI) with big data, infrastructure and cloud computing, advanced computation and data processing, privacy and cybersecurity, health economic outcomes and technology management, and smart healthcare with sensing, wearable devices and Internet of things (IoT). Current challenges of dealing with big data and big data analytics in medical engineering and healthcare as well as future work are also presented.",https://doi.org/10.1080/03091902.2020.1769758,Semantic Scholar citation chain,Big Data Analytics: A Survey,backward chaining,91.0,0.0,,6878,2026-04-28T00:06:36.923524+00:00,False,40.0,97.98,20.0,0.0,75.0,71.94,,auto-include,Crossref DOI,54d0819ceb5d42939ac9f123427bed6e
Open-CyKG: An Open Cyber Threat Intelligence Knowledge Graph,Injy Sarhan; Marco Spruit,2021.0,Knowledge-Based Systems,10.1016/j.knosys.2021.107524,"Abstract Instant analysis of cybersecurity reports is a fundamental challenge for security experts as an immeasurable amount of cyber information is generated on a daily basis, which necessitates automated information extraction tools to facilitate querying and retrieval of data. Hence, we present Open-CyKG: an Open Cyber Threat Intelligence (CTI) Knowledge Graph (KG) framework that is constructed using an attention-based neural Open Information Extraction (OIE) model to extract valuable cyber threat information from unstructured Advanced Persistent Threat (APT) reports. More specifically, we first identify relevant entities by developing a neural cybersecurity Named Entity Recognizer (NER) that aids in labeling relation triples generated by the OIE model. Afterwards, the extracted structured data is canonicalized to build the KG by employing fusion techniques using word embeddings. As a result, security professionals can execute queries to retrieve valuable information from the Open-CyKG framework. Experimental results demonstrate that our proposed components that build up Open-CyKG outperform state-of-the-art models. 1",https://doi.org/10.1016/j.knosys.2021.107524,Semantic Scholar citation chain,Detecting Cybersecurity Attacks in Internet of Things Using Artificial Intelligence Methods: A Systematic Literature Review,backward chaining,96.0,0.0,,6890,2026-04-28T00:06:36.923524+00:00,False,40.0,99.12,20.0,0.0,100.0,78.65,,auto-include,Crossref DOI,54d0819ceb5d42939ac9f123427bed6e
The influence of eWOM in social media on consumers’ purchase intentions: An extended approach to information adoption,Ismail Erkan; Chris Evans,2016.0,Computers in Human Behavior,10.1016/j.chb.2016.03.003,,https://doi.org/10.1016/j.chb.2016.03.003,OpenAlex citation chain,Determining Sample Size for Research Activities,forward chaining,1110.0,91.0,,8269,2026-04-28T00:06:36.923524+00:00,False,40.0,100.0,20.0,0.0,25.0,60.25,,auto-include,Crossref DOI,54d0819ceb5d42939ac9f123427bed6e
Linking Green and Sustainable Entrepreneurial Intentions and Social Networking Sites; The Mediating Role of Self-Efficacy and Risk Propensity,Iftikhar Hussain; Mehrab Nazir; Saadia Bano Hashmi; Imrab Shaheen; Sabahat Akram; Muhammad Arfaq Waseem; Adeel Arshad,2021.0,Sustainability,10.3390/su13137050,"This study investigated the impact of the use of social networking sites on university graduate students’ green sustainable entrepreneurial intentions by developing a mediating effect. This study provided a research framework using Ajzen’s theory of planned behavior and Shapero’s model to illustrate the relationship between self-efficacy and risk propensity towards green and sustainable entrepreneurial intentions. This research model posited a relationship between the use of social networking sites and green and sustainable entrepreneurship intentions with a mediating role of risk propensity and self-efficacy. The structural questionnaire was adopted, validated, and disseminated to the 300 respondents of university students. This study’s findings confirmed that there was a significant positive effect of the use of social networking sites on green and sustainable entrepreneurship intentions with the indirect impact of risk propensity and self-efficacy. These substantial outcomes have essential practices and academic implications for representatives, policy makers, and entrepreneurial institutes, such as how to direct the use of such relative niche technologies for communication and the role of the internet to promote green and sustainable entrepreneurial practices among young people.",https://doi.org/10.3390/su13137050,OpenAlex citation chain,Determining Sample Size for Research Activities,forward chaining,72.0,72.0,,8272,2026-04-28T00:06:36.923524+00:00,False,40.0,92.97,20.0,0.0,62.5,66.81,,auto-include,Crossref DOI,54d0819ceb5d42939ac9f123427bed6e
"Research dilemmas: Paradigms, methods and methodology",Noella Mackenzie; Sally Knipe,2006.0,Issues in educational research,,,https://brainmass.com/file/125444/mackenzie.pdf,OpenAlex citation chain,Determining Sample Size for Research Activities,forward chaining,1233.0,16.0,,8275,2026-04-28T00:06:36.923524+00:00,False,40.0,100.0,20.0,0.0,37.5,63.38,,auto-include,,54d0819ceb5d42939ac9f123427bed6e
Review Article Digital change detection techniques using remotely-sensed data,ASHBINDU SINGH,1989.0,International Journal of Remote Sensing,10.1080/01431168908903939,,https://doi.org/10.1080/01431168908903939,OpenAlex citation chain,Statistical and structural approaches to texture,forward chaining,3778.0,37.0,,8280,2026-04-28T00:06:36.923524+00:00,False,40.0,100.0,20.0,0.0,25.0,60.25,,auto-include,Crossref DOI,54d0819ceb5d42939ac9f123427bed6e
EntropyHub: An open-source toolkit for entropic time series analysis,Matthew W. Flood; Bernd Grimm,2021.0,PLOS ONE,10.1371/journal.pone.0259448,"An increasing number of studies across many research fields from biomedical engineering to finance are employing measures of entropy to quantify the regularity, variability or randomness of time series and image data. Entropy, as it relates to information theory and dynamical systems theory, can be estimated in many ways, with newly developed methods being continuously introduced in the scientific literature. Despite the growing interest in entropic time series and image analysis, there is a shortage of validated, open-source software tools that enable researchers to apply these methods. To date, packages for performing entropy analysis are often run using graphical user interfaces, lack the necessary supporting documentation, or do not include functions for more advanced entropy methods, such as cross-entropy, multiscale cross-entropy or bidimensional entropy. In light of this, this paper introduces EntropyHub , an open-source toolkit for performing entropic time series analysis in MATLAB, Python and Julia. EntropyHub (version 0.1) provides an extensive range of more than forty functions for estimating cross-, multiscale, multiscale cross-, and bidimensional entropy, each including a number of keyword arguments that allows the user to specify multiple parameters in the entropy calculation. Instructions for installation, descriptions of function syntax, and examples of use are fully detailed in the supporting documentation, available on the EntropyHub website– www.EntropyHub.xyz . Compatible with Windows, Mac and Linux operating systems, EntropyHub is hosted on GitHub, as well as the native package repository for MATLAB, Python and Julia, respectively. The goal of EntropyHub is to integrate the many established entropy methods into one complete resource, providing tools that make advanced entropic time series analysis straightforward and reproducible.",https://doi.org/10.1371/journal.pone.0259448,OpenAlex citation chain,Statistical and structural approaches to texture,forward chaining,118.0,119.0,,8294,2026-04-28T00:06:36.923524+00:00,False,40.0,100.0,20.0,0.0,75.0,72.75,,auto-include,Crossref DOI,54d0819ceb5d42939ac9f123427bed6e
"Internet of Things: A Survey on Enabling Technologies, Protocols, and Applications",Ala Al-Fuqaha; Mohsen Guizani; Mehdi Mohammadi; Mohammed Aledhari; Moussa Ayyash,2015.0,IEEE Communications Surveys &amp; Tutorials,10.1109/comst.2015.2444095,,https://doi.org/10.1109/comst.2015.2444095,OpenAlex citation chain,Architectural styles and the design of network-based software architectures,forward chaining,8196.0,178.0,,8295,2026-04-28T00:06:36.923524+00:00,False,100.0,100.0,20.0,0.0,12.5,78.12,,auto-include,Crossref DOI,54d0819ceb5d42939ac9f123427bed6e
Internet of Things for Smart Cities,Andrea Zanella; Nicola Bui; Angelo Castellani; Lorenzo Vangelista; Michele Zorzi,2014.0,IEEE Internet of Things Journal,10.1109/jiot.2014.2306328,,https://doi.org/10.1109/jiot.2014.2306328,OpenAlex citation chain,Architectural styles and the design of network-based software architectures,forward chaining,6035.0,42.0,,8296,2026-04-28T00:06:36.923524+00:00,False,100.0,100.0,20.0,0.0,12.5,78.12,,auto-include,Crossref DOI,54d0819ceb5d42939ac9f123427bed6e
"Entity Linking with a Knowledge Base: Issues, Techniques, and Solutions",Wei Shen; Jianyong Wang; Jiawei Han,2014.0,IEEE Transactions on Knowledge and Data Engineering,10.1109/tkde.2014.2327028,,https://doi.org/10.1109/tkde.2014.2327028,OpenAlex citation chain,Learning to rank using gradient descent,forward chaining,756.0,206.0,,8354,2026-04-28T00:06:36.923524+00:00,False,100.0,100.0,20.0,0.0,12.5,78.12,,auto-include,Crossref DOI,54d0819ceb5d42939ac9f123427bed6e
A Survey on Security Threats and Detection Techniques in Cognitive Radio Networks,Alexandros G. Fragkiadakis; Elias Z. Tragos; Ioannis G. Askoxylakis,2012.0,IEEE Communications Surveys &amp; Tutorials,10.1109/surv.2011.122211.00162,,https://doi.org/10.1109/surv.2011.122211.00162,OpenAlex citation chain,Implementation issues in spectrum sensing for cognitive radios,forward chaining,443.0,129.0,,8379,2026-04-28T00:06:36.923524+00:00,False,100.0,100.0,20.0,0.0,37.5,84.38,,auto-include,Crossref DOI,54d0819ceb5d42939ac9f123427bed6e
A Survey of Security Challenges in Cognitive Radio Networks: Solutions and Future Research Directions,Alireza Attar; Helen Tang; Athanasios V. Vasilakos; F. Richard Yu; Victor C. M. Leung,2012.0,Proceedings of the IEEE,10.1109/jproc.2012.2208211,,https://doi.org/10.1109/jproc.2012.2208211,OpenAlex citation chain,Implementation issues in spectrum sensing for cognitive radios,forward chaining,276.0,85.0,,8380,2026-04-28T00:06:36.923524+00:00,False,100.0,100.0,20.0,0.0,12.5,78.12,,auto-include,Crossref DOI,54d0819ceb5d42939ac9f123427bed6e
Advances on Security Threats and Countermeasures for Cognitive Radio Networks: A Survey,Rajesh K. Sharma; Danda B. Rawat,2015.0,IEEE Communications Surveys &amp; Tutorials,10.1109/comst.2014.2380998,,https://doi.org/10.1109/comst.2014.2380998,OpenAlex citation chain,Implementation issues in spectrum sensing for cognitive radios,forward chaining,228.0,150.0,,8381,2026-04-28T00:06:36.923524+00:00,False,100.0,100.0,20.0,0.0,25.0,81.25,,auto-include,Crossref DOI,54d0819ceb5d42939ac9f123427bed6e
1-V power supply high-speed digital circuit technology with multithreshold-voltage CMOS,S. Mutoh; T. Douseki; Y. Matsuya; T. Aoki; S. Shigematsu; J. Yamada,1995.0,IEEE Journal of Solid-State Circuits,10.1109/4.400426,,https://doi.org/10.1109/4.400426,OpenAlex citation chain,Low-Power CMOS Digital Design,forward chaining,1112.0,9.0,,8412,2026-04-28T00:06:36.923524+00:00,False,100.0,100.0,20.0,0.0,12.5,78.12,,auto-include,Crossref DOI,54d0819ceb5d42939ac9f123427bed6e
Minimizing power consumption in digital CMOS circuits,A.P. Chandrakasan; R.W. Brodersen,1995.0,Proceedings of the IEEE,10.1109/5.371964,,https://doi.org/10.1109/5.371964,OpenAlex citation chain,Low-Power CMOS Digital Design,forward chaining,999.0,25.0,,8414,2026-04-28T00:06:36.923524+00:00,False,100.0,100.0,20.0,0.0,12.5,78.12,,auto-include,Crossref DOI,54d0819ceb5d42939ac9f123427bed6e
