title,authors,year,venue,doi,abstract,source_url,discovery_source,discovery_query,inclusion_path,citation_count,reference_count,affiliations,candidate_id,scored_at,is_preprint,venue_score,citation_score,institution_score,institution_bonus,relevance_score,total_quality_score,review_reason,recommended_action,harvest_source,rescore_run_id
"Review of Artificial Intelligence and Machine Learning Technologies: Classification, Restrictions, Opportunities and Challenges",Ravil I. Mukhamediev; Yelena Popova; Yan Kuchin; Elena Zaitseva; Almas Kalimoldayev; Adilkhan Symagulov; Vitaly Levashenko; Farida Abdoldina; Viktors Gopejenko; Kirill Yakunin; Elena Muhamedijeva; Marina Yelis,2022.0,Mathematics,10.3390/math10152552,"Artificial intelligence (AI) is an evolving set of technologies used for solving a wide range of applied issues. The core of AI is machine learning (ML)—a complex of algorithms and methods that address the problems of classification, clustering, and forecasting. The practical application of AI&ML holds promising prospects. Therefore, the researches in this area are intensive. However, the industrial applications of AI and its more intensive use in society are not widespread at the present time. The challenges of widespread AI applications need to be considered from both the AI (internal problems) and the societal (external problems) perspective. This consideration will identify the priority steps for more intensive practical application of AI technologies, their introduction, and involvement in industry and society. The article presents the identification and discussion of the challenges of the employment of AI technologies in the economy and society of resource-based countries. The systematization of AI&ML technologies is implemented based on publications in these areas. This systematization allows for the specification of the organizational, personnel, social and technological limitations. This paper outlines the directions of studies in AI and ML, which will allow us to overcome some of the limitations and achieve expansion of the scope of AI&ML applications.",https://doi.org/10.3390/math10152552,OpenAlex citation chain,Artificial intelligence for cybersecurity: Literature review and future research directions,forward chaining,247.0,151.0,,8922,2026-04-28T00:06:36.923524+00:00,False,40.0,100.0,20.0,0.0,62.5,69.62,Quality uncertain or moderate,human review,Crossref DOI,54d0819ceb5d42939ac9f123427bed6e
A comprehensive literature review of the applications of AI techniques through the lifecycle of industrial equipment,Mahboob Elahi; Samuel Olaiya Afolaranmi; Jose Luis Martinez Lastra; Jose Antonio Perez Garcia,2023.0,Discover Artificial Intelligence,10.1007/s44163-023-00089-x,"Abstract Driven by the ongoing migration towards Industry 4.0, the increasing adoption of artificial intelligence (AI) has empowered smart manufacturing and digital transformation. AI enhances the migration towards industry 4.0 through AI-based decision-making by analyzing real-time data to optimize different processes such as production planning, predictive maintenance, quality control etc., thus guaranteeing reduced costs, high precision, efficiency and accuracy. This paper explores AI-driven smart manufacturing, revolutionizing traditional approaches and unlocking new possibilities throughout the major phases of the industrial equipment lifecycle. Through a comprehensive review, we delve into a wide range of AI techniques employed to tackle challenges such as optimizing process control, machining parameters, facilitating decision-making, and elevating maintenance strategies within the major phases of an industrial equipment lifecycle. These phases encompass design, manufacturing, maintenance, and recycling/retrofitting. As reported in the 2022 McKinsey Global Survey ( https://www.mckinsey.com/capabilities/quantumblack/our-insights/the-state-of-ai-in-2022-and-a-half-decade-in-review ), the adoption of AI has witnessed more than a two-fold increase since 2017. This has contributed to an increase in AI research within the last six years. Therefore, from a meticulous search of relevant electronic databases, we carefully selected and synthesized 42 articles spanning from 01 January 2017 to 20 May 2023 to highlight and review the most recent research, adhering to specific inclusion and exclusion criteria, and shedding light on the latest trends and popular AI techniques adopted by researchers. This includes AI techniques such as Convolutional Neural Networks (CNN), Generative Adversarial Networks (GAN), Bayesian Networks, Support Vector Machines (SVM) etc., which are extensively discussed in this paper. Additionally, we provide insights into the advantages (e.g., enhanced decision making) and challenges (e.g., AI integration with legacy systems due to technical complexities and compatibilities) of integrating AI across the major stages of industrial equipment operations. Strategically implementing AI techniques in each phase enables industries to achieve enhanced productivity, improved product quality, cost-effectiveness, and sustainability. This exploration of the potential of AI in smart manufacturing fosters agile and resilient processes, keeping industries at the forefront of technological advancements and harnessing the full potential of AI-driven solutions to improve manufacturing processes and products.",https://doi.org/10.1007/s44163-023-00089-x,OpenAlex citation chain,Artificial intelligence for cybersecurity: Literature review and future research directions,forward chaining,241.0,322.0,,8923,2026-04-28T00:06:36.923524+00:00,False,40.0,100.0,20.0,0.0,50.0,66.5,Quality uncertain or moderate,human review,Crossref DOI,54d0819ceb5d42939ac9f123427bed6e
Explainable Artificial Intelligence (XAI): Concepts and Challenges in Healthcare,Tim Hulsen,2023.0,AI,10.3390/ai4030034,"Artificial Intelligence (AI) describes computer systems able to perform tasks that normally require human intelligence, such as visual perception, speech recognition, decision-making, and language translation. Examples of AI techniques are machine learning, neural networks, and deep learning. AI can be applied in many different areas, such as econometrics, biometry, e-commerce, and the automotive industry. In recent years, AI has found its way into healthcare as well, helping doctors make better decisions (“clinical decision support”), localizing tumors in magnetic resonance images, reading and analyzing reports written by radiologists and pathologists, and much more. However, AI has one big risk: it can be perceived as a “black box”, limiting trust in its reliability, which is a very big issue in an area in which a decision can mean life or death. As a result, the term Explainable Artificial Intelligence (XAI) has been gaining momentum. XAI tries to ensure that AI algorithms (and the resulting decisions) can be understood by humans. In this narrative review, we will have a look at some central concepts in XAI, describe several challenges around XAI in healthcare, and discuss whether it can really help healthcare to advance, for example, by increasing understanding and trust. Finally, alternatives to increase trust in AI are discussed, as well as future research possibilities in the area of XAI.",https://doi.org/10.3390/ai4030034,OpenAlex citation chain,Artificial intelligence for cybersecurity: Literature review and future research directions,forward chaining,217.0,68.0,,8926,2026-04-28T00:06:36.923524+00:00,False,40.0,100.0,20.0,0.0,37.5,63.38,Quality uncertain or moderate,human review,Crossref DOI,54d0819ceb5d42939ac9f123427bed6e
XAI-IDS: Toward Proposing an Explainable Artificial Intelligence Framework for Enhancing Network Intrusion Detection Systems,Osvaldo Arreche; Tanish Guntur; Mustafa Abdallah,2024.0,Applied Sciences,10.3390/app14104170,"The exponential growth of network intrusions necessitates the development of advanced artificial intelligence (AI) techniques for intrusion detection systems (IDSs). However, the reliance on AI for IDSs presents several challenges, including the performance variability of different AI models and the opacity of their decision-making processes, hindering comprehension by human security analysts. In response, we propose an end-to-end explainable AI (XAI) framework tailored to enhance the interpretability of AI models in network intrusion detection tasks. Our framework commences with benchmarking seven black-box AI models across three real-world network intrusion datasets, each characterized by distinct features and challenges. Subsequently, we leverage various XAI models to generate both local and global explanations, shedding light on the underlying rationale behind the AI models’ decisions. Furthermore, we employ feature extraction techniques to discern crucial model-specific and intrusion-specific features, aiding in understanding the discriminative factors influencing the detection outcomes. Additionally, our framework identifies overlapping and significant features that impact multiple AI models, providing insights into common patterns across different detection approaches. Notably, we demonstrate that the computational overhead incurred by generating XAI explanations is minimal for most AI models, ensuring practical applicability in real-time scenarios. By offering multi-faceted explanations, our framework equips security analysts with actionable insights to make informed decisions for threat detection and mitigation. To facilitate widespread adoption and further research, we have made our source code publicly available, serving as a foundational XAI framework for IDSs within the research community.",https://doi.org/10.3390/app14104170,OpenAlex citation chain,Artificial intelligence for cybersecurity: Literature review and future research directions,forward chaining,76.0,76.0,,8929,2026-04-28T00:06:36.923524+00:00,False,40.0,94.12,20.0,0.0,75.0,70.4,Quality uncertain or moderate,human review,Crossref DOI,54d0819ceb5d42939ac9f123427bed6e
Being Pursued Online,Bradford W. Reyns; Billy Henson; Bonnie S. Fisher,2011.0,Criminal Justice and Behavior,10.1177/0093854811421448,"Building upon Eck and Clarke’s (2003) ideas for explaining crimes in which there is no face-to-face contact between victims and offenders, the authors developed an adapted lifestyle–routine activities theory. Traditional conceptions of place-based environments depend on the convergence of victims and offenders in time and physical space to explain opportunities for victimization. With their proposed cyberlifestyle–routine activities theory, the authors moved beyond this conceptualization to explain opportunities for victimization in cyberspace environments where traditional conceptions of time and space are less relevant. Cyberlifestyle–routine activities theory was tested using a sample of 974 college students on a particular type of cybervictimization—cyberstalking. The study’s findings provide support for the adapted theoretical perspective. Specifically, variables measuring online exposure to risk, online proximity to motivated offenders, online guardianship, online target attractiveness, and online deviance were significant predictors of cyberstalking victimization. Implications for advancing cyberlifestyle–routine activities theory are discussed.",https://doi.org/10.1177/0093854811421448,OpenAlex citation chain,The Novelty of ‘Cybercrime’,forward chaining,383.0,77.0,,8942,2026-04-28T00:06:36.923524+00:00,False,40.0,100.0,20.0,0.0,25.0,60.25,Quality uncertain or moderate,human review,Crossref DOI,54d0819ceb5d42939ac9f123427bed6e
CYBERSECURITY CHALLENGES IN THE AGE OF AI: THEORETICAL APPROACHES AND PRACTICAL SOLUTIONS,Babajide Tolulope Familoni,2024.0,Computer Science &amp; IT Research Journal,10.51594/csitrj.v5i3.930,"In the ever-evolving landscape of cybersecurity, the proliferation of artificial intelligence (AI) technologies introduces both promising advancements and daunting challenges. This paper explores the theoretical underpinnings and practical implications of addressing cybersecurity challenges in the age of AI. With the integration of AI into various facets of digital infrastructure, including threat detection, authentication, and response mechanisms, cyber threats have become increasingly sophisticated and difficult to mitigate. Theoretical approaches delve into understanding the intricate interplay between AI algorithms, human behavior, and adversarial tactics, elucidating the underlying mechanisms of cyber attacks and defense strategies. However, this complexity also engenders novel vulnerabilities, as AI-driven attacks leverage machine learning algorithms to evade traditional security measures, posing formidable challenges to organizations across sectors. As such, practical solutions necessitate a multifaceted approach, encompassing robust threat intelligence, adaptive defense mechanisms, and ethical considerations to safeguard against AI-driven cyber threats effectively. Leveraging AI for cybersecurity defense holds promise in enhancing detection capabilities, automating response actions, and augmenting human analysts' capabilities. Yet, inherent limitations, such as algorithmic biases, data privacy concerns, and the potential for AI-enabled attacks, underscore the need for a comprehensive risk management framework. Regulatory frameworks and industry standards play a crucial role in shaping the development and deployment of AI-powered cybersecurity solutions, ensuring accountability, transparency, and compliance with ethical principles. Moreover, fostering interdisciplinary collaboration and investing in cybersecurity education and training are vital for cultivating a skilled workforce equipped to navigate the evolving threat landscape. By integrating theoretical insights with practical strategies, this paper elucidates key challenges and opportunities in securing AI-driven systems, offering insights for policymakers, researchers, and practitioners alike. Keywords: Cybersecurity; Artificial Intelligence; Threat Detection; Defense Strategies; Ethical Considerations; Regulatory Frameworks.",https://doi.org/10.51594/csitrj.v5i3.930,OpenAlex citation chain,"AI-Driven Cybersecurity: An Overview, Security Intelligence Modeling and Research Directions",forward chaining,112.0,59.0,,8952,2026-04-28T00:06:36.923524+00:00,False,40.0,100.0,20.0,0.0,87.5,75.88,Quality uncertain or moderate,human review,Crossref DOI,54d0819ceb5d42939ac9f123427bed6e
DATA CONFIDENTIALITY AND INTEGRITY: A REVIEW OF ACCOUNTING AND CYBERSECURITY CONTROLS IN SUPERANNUATION ORGANIZATIONS,Anthony Anyanwu; Temidayo Olorunsogo; Temitayo Oluwaseun Abrahams; Odunayo Josephine Akindote; Oluwatosin Reis,2024.0,Computer Science &amp; IT Research Journal,10.51594/csitrj.v5i1.735,"In an era dominated by digital transformation, superannuation organizations face unprecedented challenges in safeguarding the confidentiality and integrity of sensitive financial data. This review explores the intricate relationship between accounting practices and cybersecurity controls within the context of superannuation entities. By examining the existing literature, regulatory frameworks, and industry best practices, this paper synthesizes the key considerations essential for ensuring robust data protection. The study delves into the critical role of accounting systems in managing financial information and the subsequent implications for data confidentiality. It investigates how evolving accounting standards and practices intersect with cybersecurity protocols to fortify the integrity of financial records within superannuation organizations. The dynamic nature of cyber threats necessitates a comprehensive analysis of technological safeguards, risk management frameworks, and compliance measures to uphold data confidentiality. Furthermore, the review underscores the imperative for a multidimensional approach to cybersecurity in the superannuation sector. It discusses the integration of advanced technologies such as encryption, blockchain, and anomaly detection alongside traditional accounting controls to create a resilient defense against emerging threats. The exploration extends to the examination of employee training programs, incident response strategies, and third-party risk assessments as integral components of a comprehensive cybersecurity posture. As superannuation organizations navigate the complex landscape of data management, a holistic understanding of the interplay between accounting and cybersecurity controls becomes paramount. This review contributes to the existing body of knowledge by providing insights into the challenges and opportunities presented by the evolving technological landscape, offering practitioners and policymakers a foundation for enhancing data confidentiality and integrity in the superannuation sector. Keywords: Data Confidentiality; Accounting; Cybersecurity; Superannuation Organization; Data Integrity.",https://doi.org/10.51594/csitrj.v5i1.735,OpenAlex citation chain,"AI-Driven Cybersecurity: An Overview, Security Intelligence Modeling and Research Directions",forward chaining,45.0,59.0,,8953,2026-04-28T00:06:36.923524+00:00,False,40.0,82.96,20.0,0.0,62.5,62.81,Quality uncertain or moderate,human review,Crossref DOI,54d0819ceb5d42939ac9f123427bed6e
Revolutionizing healthcare: the role of artificial intelligence in clinical practice,Shuroug A. Alowais; Sahar S. Alghamdi; Nada Alsuhebany; Tariq Alqahtani; Abdulrahman I. Alshaya; Sumaya N. Almohareb; Atheer Aldairem; Mohammed Alrashed; Khalid Bin Saleh; Hisham A. Badreldin; Majed S. Al Yami; Shmeylan Al Harbi; Abdulkareem M. Albekairy,2023.0,BMC Medical Education,10.1186/s12909-023-04698-z,"Abstract Introduction Healthcare systems are complex and challenging for all stakeholders, but artificial intelligence (AI) has transformed various fields, including healthcare, with the potential to improve patient care and quality of life. Rapid AI advancements can revolutionize healthcare by integrating it into clinical practice. Reporting AI’s role in clinical practice is crucial for successful implementation by equipping healthcare providers with essential knowledge and tools. Research Significance This review article provides a comprehensive and up-to-date overview of the current state of AI in clinical practice, including its potential applications in disease diagnosis, treatment recommendations, and patient engagement. It also discusses the associated challenges, covering ethical and legal considerations and the need for human expertise. By doing so, it enhances understanding of AI’s significance in healthcare and supports healthcare organizations in effectively adopting AI technologies. Materials and Methods The current investigation analyzed the use of AI in the healthcare system with a comprehensive review of relevant indexed literature, such as PubMed/Medline, Scopus, and EMBASE, with no time constraints but limited to articles published in English. The focused question explores the impact of applying AI in healthcare settings and the potential outcomes of this application. Results Integrating AI into healthcare holds excellent potential for improving disease diagnosis, treatment selection, and clinical laboratory testing. AI tools can leverage large datasets and identify patterns to surpass human performance in several healthcare aspects. AI offers increased accuracy, reduced costs, and time savings while minimizing human errors. It can revolutionize personalized medicine, optimize medication dosages, enhance population health management, establish guidelines, provide virtual health assistants, support mental health care, improve patient education, and influence patient-physician trust. Conclusion AI can be used to diagnose diseases, develop personalized treatment plans, and assist clinicians with decision-making. Rather than simply automating tasks, AI is about developing technologies that can enhance patient care across healthcare settings. However, challenges related to data privacy, bias, and the need for human expertise must be addressed for the responsible and effective implementation of AI in healthcare.",https://doi.org/10.1186/s12909-023-04698-z,OpenAlex citation chain,"Cybersecurity in healthcare: A narrative review of trends, threats and ways forward",forward chaining,2655.0,117.0,,8970,2026-04-28T00:06:36.923524+00:00,False,40.0,100.0,20.0,0.0,50.0,66.5,Quality uncertain or moderate,human review,Crossref DOI,54d0819ceb5d42939ac9f123427bed6e
Challenges to implementing artificial intelligence in healthcare: a qualitative interview study with healthcare leaders in Sweden,Lena Petersson; Ingrid Larsson; Jens M. Nygren; Per Nilsen; Margit Neher; Julie E. Reed; Daniel Tyskbo; Petra Svedberg,2022.0,BMC Health Services Research,10.1186/s12913-022-08215-8,"Abstract Background Artificial intelligence (AI) for healthcare presents potential solutions to some of the challenges faced by health systems around the world. However, it is well established in implementation and innovation research that novel technologies are often resisted by healthcare leaders, which contributes to their slow and variable uptake. Although research on various stakeholders’ perspectives on AI implementation has been undertaken, very few studies have investigated leaders’ perspectives on the issue of AI implementation in healthcare. It is essential to understand the perspectives of healthcare leaders, because they have a key role in the implementation process of new technologies in healthcare. The aim of this study was to explore challenges perceived by leaders in a regional Swedish healthcare setting concerning the implementation of AI in healthcare. Methods The study takes an explorative qualitative approach. Individual, semi-structured interviews were conducted from October 2020 to May 2021 with 26 healthcare leaders. The analysis was performed using qualitative content analysis, with an inductive approach. Results The analysis yielded three categories, representing three types of challenge perceived to be linked with the implementation of AI in healthcare: 1) Conditions external to the healthcare system; 2) Capacity for strategic change management; 3) Transformation of healthcare professions and healthcare practice. Conclusions In conclusion, healthcare leaders highlighted several implementation challenges in relation to AI within and beyond the healthcare system in general and their organisations in particular. The challenges comprised conditions external to the healthcare system, internal capacity for strategic change management, along with transformation of healthcare professions and healthcare practice. The results point to the need to develop implementation strategies across healthcare organisations to address challenges to AI-specific capacity building. Laws and policies are needed to regulate the design and execution of effective AI implementation strategies. There is a need to invest time and resources in implementation processes, with collaboration across healthcare, county councils, and industry partnerships.",https://doi.org/10.1186/s12913-022-08215-8,OpenAlex citation chain,"Cybersecurity in healthcare: A narrative review of trends, threats and ways forward",forward chaining,397.0,72.0,,8973,2026-04-28T00:06:36.923524+00:00,False,40.0,100.0,20.0,0.0,50.0,66.5,Quality uncertain or moderate,human review,Crossref DOI,54d0819ceb5d42939ac9f123427bed6e
OmegaLog: High-Fidelity Attack Investigation via Transparent Multi-layer Log Analysis,Wajih Ul Hassan; Mohammad A. Noureddine; Pubali Datta; Adam Bates,2020.0,Proceedings 2020 Network and Distributed System Security Symposium,10.14722/ndss.2020.24270,,https://doi.org/10.14722/ndss.2020.24270,OpenAlex citation chain,HOLMES: Real-Time APT Detection through Correlation of Suspicious Information Flows,forward chaining,115.0,60.0,,8983,2026-04-28T00:06:36.923524+00:00,False,100.0,100.0,20.0,0.0,12.5,78.12,Quality uncertain or moderate,human review,Crossref DOI,54d0819ceb5d42939ac9f123427bed6e
