title,authors,year,venue,doi,abstract,source_url,discovery_source,discovery_query,inclusion_path,citation_count,reference_count,affiliations,candidate_id,scored_at,is_preprint,venue_score,citation_score,institution_score,institution_bonus,relevance_score,total_quality_score,review_reason,recommended_action,harvest_source,rescore_run_id
Digital Transformation and Innovation Management: A Synthesis of Existing Research and an Agenda for Future Studies,Francesco Paolo Appio; Federico Frattini; Antonio Messeni Petruzzelli; Paolo Neirotti,2021.0,Journal of Product Innovation Management,10.1111/jpim.12562,"Abstract Management and organizational scholars have paid increasing attention to the interconnections between digital transformation and innovation management in the last decade. However, a highly fragmented understanding of this topic is what we are left with so far. In this editorial, we suggest an approach to open up the black box of the interplay between digital transformation and innovation management by providing a framework that identifies three levels of analyisis (i.e., macro, meso, and micro) along which existing and future research on the topic can be organized. This model encourages scholars to conduct theoretical and empirical studies on how digital transformation affects ecosystems’ structure and governance, how industries and firms compete and organize for innovation in a digitalized world, how the processes for developing new products and services change under the effect of digital technologies, and the implications of digital transformation on managing people and teams involved in the innovation process, among the other topics. We also provide a synthesis of the eight papers published in the Special Issue that this editorial introduces and develop an agenda for future research that will hopefully contribute to encourage and shape future scholarly efforts into this field.",https://doi.org/10.1111/jpim.12562,OpenAlex citation chain,Digital transformation: A multidisciplinary reflection and research agenda,forward chaining,675.0,107.0,,11439,2026-04-28T00:06:36.923524+00:00,False,40.0,100.0,20.0,0.0,37.5,63.38,,auto-include,Crossref DOI,54d0819ceb5d42939ac9f123427bed6e
Digital transformation: A review and research agenda,Dmitry Plekhanov; Henrik Franke; Torbjørn H. Netland,2022.0,European Management Journal,10.1016/j.emj.2022.09.007,,https://doi.org/10.1016/j.emj.2022.09.007,OpenAlex citation chain,Digital transformation: A multidisciplinary reflection and research agenda,forward chaining,458.0,255.0,,11441,2026-04-28T00:06:36.923524+00:00,False,40.0,100.0,20.0,0.0,25.0,60.25,,auto-include,Crossref DOI,54d0819ceb5d42939ac9f123427bed6e
Electroencephalography Signal Processing: A Comprehensive Review and Analysis of Methods and Techniques,Ahmad Chaddad; Yihang Wu; Reem Kateb; Ahmed Bouridane,2023.0,Sensors,10.3390/s23146434,"The electroencephalography (EEG) signal is a noninvasive and complex signal that has numerous applications in biomedical fields, including sleep and the brain–computer interface. Given its complexity, researchers have proposed several advanced preprocessing and feature extraction methods to analyze EEG signals. In this study, we analyze a comprehensive review of numerous articles related to EEG signal processing. We searched the major scientific and engineering databases and summarized the results of our findings. Our survey encompassed the entire process of EEG signal processing, from acquisition and pretreatment (denoising) to feature extraction, classification, and application. We present a detailed discussion and comparison of various methods and techniques used for EEG signal processing. Additionally, we identify the current limitations of these techniques and analyze their future development trends. We conclude by offering some suggestions for future research in the field of EEG signal processing.",https://doi.org/10.3390/s23146434,OpenAlex citation chain,A guide to deep learning in healthcare,forward chaining,232.0,165.0,,11447,2026-04-28T00:06:36.923524+00:00,False,40.0,100.0,20.0,0.0,50.0,66.5,,auto-include,Crossref DOI,54d0819ceb5d42939ac9f123427bed6e
Internet of Things (IoT) Assisted Context Aware Fertilizer Recommendation,Arfat Ahmad Khan; Muhammad Faheem; Rab Nawaz Bashir; Chitapong Wechtaisong; Muhammad Zahid Abbas,2022.0,IEEE Access,10.1109/access.2022.3228160,,https://doi.org/10.1109/access.2022.3228160,OpenAlex citation chain,Deep learning in agriculture: A survey,forward chaining,109.0,51.0,,11455,2026-04-28T00:06:36.923524+00:00,False,100.0,100.0,20.0,0.0,12.5,78.12,,auto-include,Crossref DOI,54d0819ceb5d42939ac9f123427bed6e
Pollution to solution: Capture and sequestration of carbon dioxide (CO 2 ) and its utilization as a renewable energy source for a sustainable future,Farahiyah Abdul Rahman; Md Maniruzzaman A. Aziz; R. Saidur; Wan Azelee Wan Abu Bakar; M.R Hainin; Ramadhansyah Putrajaya; Norhidayah Abdul Hassan,2017.0,Renewable and Sustainable Energy Reviews,10.1016/j.rser.2017.01.011,,https://doi.org/10.1016/j.rser.2017.01.011,OpenAlex citation chain,Carbon capture and storage (CCS): the way forward,forward chaining,671.0,164.0,,11488,2026-04-28T00:06:36.923524+00:00,False,40.0,100.0,20.0,0.0,25.0,60.25,,auto-include,Crossref DOI,54d0819ceb5d42939ac9f123427bed6e
"Users of the world, unite! The challenges and opportunities of Social Media",Andreas M. Kaplan; Michael Haenlein,2009.0,Business Horizons,10.1016/j.bushor.2009.09.003,,https://doi.org/10.1016/j.bushor.2009.09.003,OpenAlex citation chain,The Field behind the Screen: Using Netnography for Marketing Research in Online Communities,forward chaining,17375.0,18.0,,11543,2026-04-28T00:06:36.923524+00:00,False,40.0,100.0,20.0,0.0,25.0,60.25,,auto-include,Crossref DOI,54d0819ceb5d42939ac9f123427bed6e
Effects of Word-of-Mouth versus Traditional Marketing: Findings from an Internet Social Networking Site,Michael Trusov; Randolph E. Bucklin; Koen Pauwels,2009.0,Journal of Marketing,10.1509/jmkg.73.5.90,"The authors study the effect of word-of-mouth (WOM) marketing on member growth at an Internet social networking site and compare it with traditional marketing vehicles. Because social network sites record the electronic invitations from existing members, outbound WOM can be precisely tracked. Along with traditional marketing, WOM can then be linked to the number of new members subsequently joining the site (sign-ups). Because of the endogeneity among WOM, new sign-ups, and traditional marketing activity, the authors employ a vector autoregressive (VAR) modeling approach. Estimates from the VAR model show that WOM referrals have substantially longer carryover effects than traditional marketing actions and produce substantially higher response elasticities. Based on revenue from advertising impressions served to a new member, the monetary value of a WOM referral can be calculated; this yields an upper-bound estimate for the financial incentives the firm might offer to stimulate WOM.",https://doi.org/10.1509/jmkg.73.5.90,OpenAlex citation chain,The Field behind the Screen: Using Netnography for Marketing Research in Online Communities,forward chaining,2382.0,55.0,,11546,2026-04-28T00:06:36.923524+00:00,False,40.0,100.0,20.0,0.0,25.0,60.25,,auto-include,Crossref DOI,54d0819ceb5d42939ac9f123427bed6e
Word of mouth communication within online communities: Conceptualizing the online social network,Jo Brown; Amanda J. Broderick; Nick Lee,2007.0,Journal of Interactive Marketing,10.1002/dir.20082,"Word of mouth (WOM) communication is a major part of online consumer interactions, particularly within the environment of online communities. Nevertheless, existing (offline) theory may be inappropriate to describe online WOM and its influence on evaluation and purchase. The authors report the results of a two-stage study aimed at investigating online WOM: a set of in-depth qualitative interviews followed by a social network analysis of a single online community. Combined, the results provide strong evidence that individuals behave as if Web sites themselves are primary “actors” in online social networks and that online communities can act as a social proxy for individual identification. The authors offer a conceptualization of online social networks which takes the Web site into account as an actor, an initial exploration of the concept of a consumer–Web site relationship, and a conceptual model of the online interaction and information evaluation process.",https://doi.org/10.1002/dir.20082,OpenAlex citation chain,The Field behind the Screen: Using Netnography for Marketing Research in Online Communities,forward chaining,1654.0,97.0,,11547,2026-04-28T00:06:36.923524+00:00,False,40.0,100.0,20.0,0.0,37.5,63.38,,auto-include,Crossref DOI,54d0819ceb5d42939ac9f123427bed6e
Review ArticleDigital change detection methods in ecosystem monitoring: a review,P. Coppin; I. Jonckheere; K. Nackaerts; B. Muys; E. Lambin,2004.0,International Journal of Remote Sensing,10.1080/0143116031000101675,,https://doi.org/10.1080/0143116031000101675,OpenAlex citation chain,Review Article Digital change detection techniques using remotely-sensed data,forward chaining,2059.0,120.0,,11561,2026-04-28T00:06:36.923524+00:00,False,40.0,100.0,20.0,0.0,25.0,60.25,,auto-include,Crossref DOI,54d0819ceb5d42939ac9f123427bed6e
A Deeply Supervised Attention Metric-Based Network and an Open Aerial Image Dataset for Remote Sensing Change Detection,Qian Shi; Mengxi Liu; Shengchen Li; Xiaoping Liu; Fei Wang; Liangpei Zhang,2021.0,IEEE Transactions on Geoscience and Remote Sensing,10.1109/tgrs.2021.3085870,,https://doi.org/10.1109/tgrs.2021.3085870,OpenAlex citation chain,Review Article Digital change detection techniques using remotely-sensed data,forward chaining,615.0,57.0,,11565,2026-04-28T00:06:36.923524+00:00,False,100.0,100.0,20.0,0.0,12.5,78.12,,auto-include,Crossref DOI,54d0819ceb5d42939ac9f123427bed6e
Towards a semantic Construction Digital Twin: Directions for future research,Calin Boje; Annie Guerriero; Sylvain Kubicki; Yacine Rezgui,2020.0,Automation in Construction,10.1016/j.autcon.2020.103179,,https://doi.org/10.1016/j.autcon.2020.103179,OpenAlex citation chain,Digital Twin in Industry: State-of-the-Art,forward chaining,1099.0,137.0,,11604,2026-04-28T00:06:36.923524+00:00,False,40.0,100.0,20.0,0.0,25.0,60.25,,auto-include,Crossref DOI,54d0819ceb5d42939ac9f123427bed6e
Artificial intelligence in histopathology: enhancing cancer research and clinical oncology,Artem Shmatko; Narmin Ghaffari Laleh; Moritz Gerstung; Jakob Nikolas Kather,2022.0,Nature Cancer,10.1038/s43018-022-00436-4,,https://doi.org/10.1038/s43018-022-00436-4,OpenAlex citation chain,Artificial intelligence in radiology,forward chaining,401.0,162.0,,11621,2026-04-28T00:06:36.923524+00:00,False,40.0,100.0,20.0,0.0,25.0,60.25,,auto-include,Crossref DOI,54d0819ceb5d42939ac9f123427bed6e
Analysis of Dimensionality Reduction Techniques on Big Data,G. Thippa Reddy; M. Praveen Kumar Reddy; Kuruva Lakshmanna; Rajesh Kaluri; Dharmendra Singh Rajput; Gautam Srivastava; Thar Baker,2020.0,IEEE Access,10.1109/access.2020.2980942,,https://doi.org/10.1109/access.2020.2980942,OpenAlex citation chain,UNSW-NB15: a comprehensive data set for network intrusion detection systems (UNSW-NB15 network data set),forward chaining,853.0,43.0,,11627,2026-04-28T00:06:36.923524+00:00,False,100.0,100.0,20.0,0.0,12.5,78.12,,auto-include,Crossref DOI,54d0819ceb5d42939ac9f123427bed6e
Construct Measurement and Validation Procedures in MIS and Behavioral Research: Integrating New and Existing Techniques1,Scott B. MacKenzie; Philip M. Podsakoff; Nathan P. Podsakoff,2011.0,MIS Quarterly,10.2307/23044045,"Despite the fact that validating the measures of constructs is critical to building cumulative knowledge in MIS and the behavioral sciences, the process of scale development and validation continues to be a challenging activity. Undoubtedly, part of the problem is that many of the scale development procedures advocated in the literature are limited by the fact that they (1) fail to adequately discuss how to develop appropriate conceptual definitions of the focal construct, (2) often fail to properly specify the measurement model that relates the latent construct to its indicators, and (3) underutilize techniques that provide evidence that the set of items used to represent the focal construct actually measures what it purports to measure. Therefore, the purpose of the present paper is to integrate new and existing techniques into a comprehensive set of recommendations that can be used to give researchers in MIS and the behavioral sciences a framework for developing valid measures. First, we briefly elaborate upon some of the limitations of current scale development practices. Following this, we discuss each of the steps in the scale development process while paying particular attention to the differences that are required when one is attempting to develop scales for constructs with formative indicators as opposed to constructs with reflective indicators. Finally, we discuss several things that should be done after the initial development of a scale to examine its generalizability and to enhance its usefulness.",https://doi.org/10.2307/23044045,OpenAlex citation chain,Formative Versus Reflective Indicators in Organizational Measure Development: A Comparison and Empirical Illustration,forward chaining,2918.0,142.0,,11650,2026-04-28T00:06:36.923524+00:00,False,40.0,100.0,20.0,0.0,25.0,60.25,,auto-include,Crossref DOI,54d0819ceb5d42939ac9f123427bed6e
"Customer experience challenges: bringing together digital, physical and social realms",Ruth N. Bolton; Janet R. McColl-Kennedy; Lilliemay Cheung; Andrew Gallan; Chiara Orsingher; Lars Witell; Mohamed Zaki,2018.0,Journal of Service Management,10.1108/josm-04-2018-0113,"Purpose The purpose of this paper is to explore innovations in customer experience at the intersection of the digital, physical and social realms. It explicitly considers experiences involving new technology-enabled services, such as digital twins and automated social presence (i.e. virtual assistants and service robots). Design/methodology/approach Future customer experiences are conceptualized within a three-dimensional space – low to high digital density, low to high physical complexity and low to high social presence – yielding eight octants. Findings The conceptual framework identifies eight “dualities,” or specific challenges connected with integrating digital, physical and social realms that challenge organizations to create superior customer experiences in both business-to-business and business-to-consumer markets. The eight dualities are opposing strategic options that organizations must reconcile when co-creating customer experiences under different conditions. Research limitations/implications A review of theory demonstrates that little research has been conducted at the intersection of the digital, physical and social realms. Most studies focus on one realm, with occasional reference to another. This paper suggests an agenda for future research and gives examples of fruitful ways to study connections among the three realms rather than in a single realm. Practical implications This paper provides guidance for managers in designing and managing customer experiences that the authors believe will need to be addressed by the year 2050. Social implications This paper discusses important societal issues, such as individual and societal needs for privacy, security and transparency. It sets out potential avenues for service innovation in these areas. Originality/value The conceptual framework integrates knowledge about customer experiences in digital, physical and social realms in a new way, with insights for future service research, managers and public policy makers.",https://doi.org/10.1108/josm-04-2018-0113,OpenAlex citation chain,The sharing economy: Why people participate in collaborative consumption,forward chaining,799.0,141.0,,11661,2026-04-28T00:06:36.923524+00:00,False,40.0,100.0,20.0,0.0,50.0,66.5,,auto-include,Crossref DOI,54d0819ceb5d42939ac9f123427bed6e
The sharing economy and digital platforms: A review and research agenda,Will Sutherland; Mohammad Hossein Jarrahi,2018.0,International Journal of Information Management,10.1016/j.ijinfomgt.2018.07.004,,https://doi.org/10.1016/j.ijinfomgt.2018.07.004,OpenAlex citation chain,The sharing economy: Why people participate in collaborative consumption,forward chaining,677.0,196.0,,11662,2026-04-28T00:06:36.923524+00:00,False,40.0,100.0,20.0,0.0,25.0,60.25,,auto-include,Crossref DOI,54d0819ceb5d42939ac9f123427bed6e
Techniques and applications for sentiment analysis,Ronen Feldman,2013.0,Communications of the ACM,10.1145/2436256.2436274,The main applications and challenges of one of the hottest research areas in computer science.,https://doi.org/10.1145/2436256.2436274,OpenAlex citation chain,Lexicon-Based Methods for Sentiment Analysis,forward chaining,1487.0,46.0,,11681,2026-04-28T00:06:36.923524+00:00,False,100.0,100.0,20.0,0.0,25.0,81.25,,auto-include,Crossref DOI,54d0819ceb5d42939ac9f123427bed6e
A survey of sentiment analysis in social media,Lin Yue; Weitong Chen; Xue Li; Wanli Zuo; Minghao Yin,2018.0,Knowledge and Information Systems,10.1007/s10115-018-1236-4,,https://doi.org/10.1007/s10115-018-1236-4,OpenAlex citation chain,Sentiment analysis algorithms and applications: A survey,forward chaining,562.0,156.0,,11699,2026-04-28T00:06:36.923524+00:00,False,40.0,100.0,20.0,0.0,25.0,60.25,,auto-include,Crossref DOI,54d0819ceb5d42939ac9f123427bed6e
"A Survey on Aspect-Based Sentiment Analysis: Tasks, Methods, and Challenges",Wenxuan Zhang; Xin Li; Yang Deng; Lidong Bing; Wai Lam,2022.0,IEEE Transactions on Knowledge and Data Engineering,10.1109/tkde.2022.3230975,,https://doi.org/10.1109/tkde.2022.3230975,OpenAlex citation chain,Sentiment analysis algorithms and applications: A survey,forward chaining,454.0,236.0,,11704,2026-04-28T00:06:36.923524+00:00,False,100.0,100.0,20.0,0.0,12.5,78.12,,auto-include,Crossref DOI,54d0819ceb5d42939ac9f123427bed6e
"Annual Research Review: Adolescent mental health in the digital age: facts, fears, and future directions",Candice L. Odgers; Michaeline R. Jensen,2020.0,Journal of Child Psychology and Psychiatry,10.1111/jcpp.13190,"Adolescents are spending an increasing amount of their time online and connected to each other via digital technologies. Mobile device ownership and social media usage have reached unprecedented levels, and concerns have been raised that this constant connectivity is harming adolescents’ mental health. This review synthesized data from three sources: (a) narrative reviews and meta‐analyses conducted between 2014 and 2019, (b) large‐scale preregistered cohort studies and (c) intensive longitudinal and ecological momentary assessment studies, to summarize what is known about linkages between digital technology usage and adolescent mental health, with a specific focus on depression and anxiety. The review highlights that most research to date has been correlational, focused on adults versus adolescents, and has generated a mix of often conflicting small positive, negative and null associations. The most recent and rigorous large‐scale preregistered studies report small associations between the amount of daily digital technology usage and adolescents’ well‐being that do not offer a way of distinguishing cause from effect and, as estimated, are unlikely to be of clinical or practical significance. Implications for improving future research and for supporting adolescents’ mental health in the digital age are discussed.",https://doi.org/10.1111/jcpp.13190,OpenAlex citation chain,Bullying in the digital age: A critical review and meta-analysis of cyberbullying research among youth.,forward chaining,950.0,75.0,,11732,2026-04-28T00:06:36.923524+00:00,False,40.0,100.0,20.0,0.0,75.0,72.75,,auto-include,Crossref DOI,54d0819ceb5d42939ac9f123427bed6e
"A Review on Large Language Models: Architectures, Applications, Taxonomies, Open Issues and Challenges",Mohaimenul Azam Khan Raiaan; Md. Saddam Hossain Mukta; Kaniz Fatema; Nur Mohammad Fahad; Sadman Sakib; Most Marufatul Jannat Mim; Jubaer Ahmad; Mohammed Eunus Ali; Sami Azam,2024.0,IEEE Access,10.1109/access.2024.3365742,,https://doi.org/10.1109/access.2024.3365742,OpenAlex citation chain,Large language models in medicine,forward chaining,638.0,230.0,,11745,2026-04-28T00:06:36.923524+00:00,False,100.0,100.0,20.0,0.0,12.5,78.12,,auto-include,Crossref DOI,54d0819ceb5d42939ac9f123427bed6e
Forensic conflict studies: Making sense of war in the social media age,Jakob Hauter,2021.0,"Media, War &amp; Conflict",10.1177/17506352211037325,"Online media is a blessing and a curse for academic research on war. On the one hand, the internet provides unprecedented access to information from conflict zones. On the other hand, the prevalence of disinformation can make it difficult to use this information in a transparent way. This article proposes digital forensic process tracing as a methodological innovation to tackle this challenge and make case study research on the causes of war fit for the social media age. It argues that two important features of process-tracing methodology – source criticism and Bayesian updating – are well developed in theory but are rarely applied to the study of armed conflict. Digital forensic process tracing applies these features to online media sources by drawing on the journalistic practice of open source intelligence (OSINT) analysis. This article uses the case of the war in eastern Ukraine’s Donbas region to illustrate the usefulness of the proposed methodology.",https://doi.org/10.1177/17506352211037325,OpenAlex,OSINT methodology,discovery,46.0,52.0,,56,2026-04-28T00:06:36.923524+00:00,False,40.0,83.42,20.0,0.0,100.0,72.37,Quality uncertain or moderate,human review,Crossref DOI,54d0819ceb5d42939ac9f123427bed6e
Social Media Intelligence,Wendy W. Moe; David A. Schweidel,2014.0,Cambridge University Press,10.1017/cbo9781139381338,"In the world of Facebook, Twitter and Yelp, water-cooler conversations with co-workers and backyard small talk with neighbors have moved from the physical world to the digital arena. In this new landscape, organizations ranging from Fortune 500 companies to government agencies to political campaigns continuously monitor online opinions in an effort to guide their actions. Are consumers satisfied with our product? How are our policies perceived? Do voters agree with our platform? Measuring online opinion is more complex than just reading a few posted reviews. Social media is replete with noise and chatter that can contaminate monitoring efforts. By knowing what shapes online opinions, organizations can better uncover the valuable insights hidden in the social media chatter and better inform strategy. This book can help anyone facing the challenge of making sense of social media data to move beyond the current practice of social media monitoring to more comprehensive use of social media intelligence.",https://doi.org/10.1017/cbo9781139381338,OpenAlex,social media intelligence,discovery,60.0,64.0,,149,2026-04-28T00:06:36.923524+00:00,False,40.0,89.07,20.0,0.0,62.5,65.25,Quality uncertain or moderate,human review,Crossref DOI,54d0819ceb5d42939ac9f123427bed6e
Is social media intelligence private? Privacy in public and the nature of social media intelligence,Kira Vrist Rønn; Sille Obelitz Søe,2019.0,Intelligence and National Security,10.1080/02684527.2019.1553701,,https://doi.org/10.1080/02684527.2019.1553701,OpenAlex,social media intelligence,discovery,20.0,24.0,,153,2026-04-28T00:06:36.923524+00:00,False,100.0,65.97,20.0,0.0,37.5,70.76,Quality uncertain or moderate,human review,Crossref DOI,54d0819ceb5d42939ac9f123427bed6e
Incremental Hacker Forum Exploit Collection and Classification for Proactive Cyber Threat Intelligence: An Exploratory Study,Ryan Williams; Sagar Samtani; Mark Patton; Hsinchun Chen,2018.0,2018 IEEE International Conference on Intelligence and Security Informatics (ISI),10.1109/isi.2018.8587336,,https://doi.org/10.1109/isi.2018.8587336,OpenAlex,threat intelligence collection,discovery,39.0,12.0,,266,2026-04-28T00:06:36.923524+00:00,False,100.0,79.93,20.0,0.0,37.5,76.35,Quality uncertain or moderate,human review,Crossref DOI,54d0819ceb5d42939ac9f123427bed6e
