title,authors,year,venue,Category,Investigation_Type,Domains,OSINT_Source_Types,Tags,source_url,Provenance,Priority,doi,Metadata_Status,Author_List_Status,Potential_Duplicate_Group,Dedup_Recommendation,abstract,Keywords,Harvest_Source,Abstract_Source_Status,Harvest_Source_URL,Seminal_Flag,Quality_Tier,discovery_source,discovery_query,inclusion_path,citation_count,reference_count,affiliations,candidate_id,scored_at,venue_score,citation_score,institution_score,institution_bonus,relevance_score,total_quality_score,review_reason,recommended_action,harvest_source,is_preprint,rescore_run_id
A Benchmark study on Machine Learning Methods for Fake News Detection,,2021.0,ResearchGate,Foundations & Reviews,CTI,Intelligence Services; Law Enforcement; Non-Goverment Organisations; Goverment Departments,Online dataset; Online news,cyber threat intelligence; misinformation,https://www.researchgate.net/profile/Md-Tawkat-Islam-Khondaker/publication/333077208_A_Benchmark_Study_on_Machine_Learning_Methods_for_Fake_News_Detection/links/5d1198bea6fdcc2462a35118/A-Benchmark-Study-on-Machine-Learning-Methods-for-Fake-News-Detection.pdf,Browne OSINT+AI review dataset (Included/Collected Data); bibliographic normalization pending,Expanded,,venue normalized; Generated synopsis; Keyword enriched,pending external lookup,,No duplicate flag,"This paper appears to address cti within the broader area of foundations & reviews. It likely focuses on detecting, classifying, or predicting security-relevant events or indicators from open or semi-open data sources. Relevant domains include Intelligence Services; Law Enforcement; Non-Goverment Organisations; Goverment Departments.",Cyber threat intelligence; Misinformation; Intelligence Services; Law Enforcement; Non-Goverment Organisations; Goverment Departments; Online dataset; Online news; CTI; AI,,,,False,Standard,,,,,,,,,,,,,,,,,,,
A Framework for Unsupervised Classificiation and Data Mining of Tweets about Cyber Vulnerabilities,,2021.0,arXiv,Cyber Threat Intelligence,CTI,Seucrity Operations; Intelligence Services,Social Media,cyber threat intelligence; vulnerability detection; social media,https://arxiv.org/abs/2104.11695,Browne OSINT+AI review dataset (Included/Collected Data); bibliographic normalization pending,Expanded,,venue normalized; Generated synopsis; Keyword enriched,pending external lookup,,No duplicate flag,"This paper appears to address cti within the broader area of cyber threat intelligence. It likely focuses on detecting, classifying, or predicting security-relevant events or indicators from open or semi-open data sources. Relevant domains include Seucrity Operations; Intelligence Services.",Cyber threat intelligence; Vulnerability detection; Social media; Seucrity Operations; Intelligence Services; CTI,,,,False,Standard,,,,,,,,,,,,,,,,,,,
A Machine Learning Approach to Twitter User Classification,,2021.0,AAAI,Threat Detection & Prediction,SOCMINT,Intelligence Services; Law Enforcement,Social Media,social media,https://ojs.aaai.org/index.php/ICWSM/article/view/14139,Browne OSINT+AI review dataset (Included/Collected Data); bibliographic normalization pending,Expanded,10.1609/icwsm.v5i1.14139,venue normalized; DOI completed; Generated synopsis; Keyword enriched,pending external lookup,,No duplicate flag,"This paper appears to address socmint within the broader area of threat detection & prediction. It likely focuses on detecting, classifying, or predicting security-relevant events or indicators from open or semi-open data sources. Relevant domains include Intelligence Services; Law Enforcement.",Social media; Intelligence Services; Law Enforcement; AI; Threat Detection Prediction; SOCMINT,,,,False,Standard,,,,,,,,,,,,,,,,,,,
Social Media Sentiment Analysis using Machine Learning Classifiers,,2017.0,,Social Media & OSINT Collection,SOCMINT,General,Social Media,social media,,Browne OSINT+AI review dataset (Included/Collected Data); bibliographic normalization pending,Expanded,,partial / pending; Generated synopsis; Keyword enriched,pending external lookup,,No duplicate flag,"This paper appears to address socmint within the broader area of social media & osint collection. It likely focuses on detecting, classifying, or predicting security-relevant events or indicators from open or semi-open data sources. Relevant domains include General.",Social media; General; AI; Social Media OSINT Collection; SOCMINT,,,,False,Standard,,,,,,,,,,,,,,,,,,,
Evaluating the Role of News Content and Social Media Interactions for Fake News Detection,,2021.0,Springer,Cyber Threat Intelligence,CTI,Intelligence Services; Law Enforcement; Non-Goverment Organisations; Goverment Departments,Online News; Social Media,cyber threat intelligence; social media; misinformation,http://dx.doi.org/10.1007/978-3-030-87031-7_9,Browne OSINT+AI review dataset (Included/Collected Data); bibliographic normalization pending,Expanded,10.1007/978-3-030-87031-7_9,venue+doi normalized; Generated synopsis; Keyword enriched,pending external lookup,,No duplicate flag,"This paper appears to address cti within the broader area of cyber threat intelligence. It likely focuses on detecting, classifying, or predicting security-relevant events or indicators from open or semi-open data sources. Relevant domains include Intelligence Services; Law Enforcement; Non-Goverment Organisations; Goverment Departments.",Cyber threat intelligence; Social media; Misinformation; Intelligence Services; Law Enforcement; Non-Goverment Organisations; Goverment Departments; Online News; CTI,,,,False,Standard,,,,,,,,,,,,,,,,,,,
"TwitterOSINT: Automated Open Source Intelligence Collection, Analysis & Visualization Tool",,2019.0,,Cyber Threat Intelligence,CTI,Intelligence Services; Law Enforcement; Penetration Testing,Social Media,OSINT; cyber threat intelligence; social media,https://www.proquest.com/docview/2153621548?pq-origsite=gscholar&fromopenview=true,Browne OSINT+AI review dataset (Included/Collected Data); bibliographic normalization pending,Expanded,,partial / pending; Generated synopsis; Keyword enriched,pending external lookup,,No duplicate flag,"This paper appears to address cti within the broader area of cyber threat intelligence. It likely contributes to threat intelligence collection, indicator extraction, or vulnerability-focused analysis using open-source data. Relevant domains include Intelligence Services; Law Enforcement; Penetration Testing.",OSINT; Cyber threat intelligence; Social media; Intelligence Services; Law Enforcement; Penetration Testing; CTI,,,,False,Standard,,,,,,,,,,,,,,,,,,,
"Combating Human Trafficking via Automatic OSINT Collection , Validation and Fusion",,2020.0,,Cyber Threat Intelligence,CTI,Intelligence Services; Law Enforcement; Non-Goverment Organisations; Goverment Departments,Online News,OSINT; cyber threat intelligence; dark web / illicit markets,http://workshop-proceedings.icwsm.org/pdf/2021_17.pdf,Browne OSINT+AI review dataset (Included/Collected Data); bibliographic normalization pending,Expanded,,partial / pending; Generated synopsis; Keyword enriched,pending external lookup,,No duplicate flag,"This paper appears to address cti within the broader area of cyber threat intelligence. It likely contributes to threat intelligence collection, indicator extraction, or vulnerability-focused analysis using open-source data. Relevant domains include Intelligence Services; Law Enforcement; Non-Goverment Organisations; Goverment Departments.",OSINT; Cyber threat intelligence; Dark web; Illicit markets; Intelligence Services; Law Enforcement; Non-Goverment Organisations; Goverment Departments; Online News; CTI,,,,False,Standard,,,,,,,,,,,,,,,,,,,
Social Sentiment Sensor in Twitter for Predicting Cyber-Attacks Using  Regularization,,2018.0,PubMed / PubMed Central,Cyber Threat Intelligence,CTI,Security Operations; Intelligence Services; Goverment Departments; Law Enforcement,Social Media,cyber threat intelligence; social media,https://www.ncbi.nlm.nih.gov/pmc/articles/PMC5982517/,Browne OSINT+AI review dataset (Included/Collected Data); bibliographic normalization pending,Expanded,10.3390/s18051380,venue normalized; DOI completed; Generated synopsis; Keyword enriched,pending external lookup,DUP-003,Review/remove as probable duplicate,"This paper appears to address cti within the broader area of cyber threat intelligence. It likely focuses on detecting, classifying, or predicting security-relevant events or indicators from open or semi-open data sources. Relevant domains include Security Operations; Intelligence Services; Goverment Departments; Law Enforcement.",Cyber threat intelligence; Social media; Security Operations; Intelligence Services; Goverment Departments; Law Enforcement; CTI,,,,False,Standard,,,,,,,,,,,,,,,,,,,
TwitterOSINT: Automated Cybersecurity Threat Intelligence Collection and Analysis using Twiter Data,,2018.0,,Cyber Threat Intelligence,CTI,Intelligence Services; Law Enforcement; Penetration Testing,Social Media,OSINT; cyber threat intelligence; social media,,Browne OSINT+AI review dataset (Included/Collected Data); bibliographic normalization pending,Expanded,,partial / pending; Generated synopsis; Keyword enriched,pending external lookup,,No duplicate flag,"This paper appears to address cti within the broader area of cyber threat intelligence. It likely contributes to threat intelligence collection, indicator extraction, or vulnerability-focused analysis using open-source data. Relevant domains include Intelligence Services; Law Enforcement; Penetration Testing.",OSINT; Cyber threat intelligence; Social media; Intelligence Services; Law Enforcement; Penetration Testing; CTI; Threat intelligence,,,,False,Standard,,,,,,,,,,,,,,,,,,,
Indirect information linkage for OSINT through authorship analysis of aliases,,2013.0,Springer,Investigative Workflows & Collaboration,Investigative Workflow,Intelligence Services; Law Enforcement; Penetration Testing,Social Media,OSINT; social media,http://link.springer.com/10.1007/978-3-642-40319-4_4,Browne OSINT+AI review dataset (Included/Collected Data); bibliographic normalization pending,Expanded,10.1007/978-3-642-40319-4_4,venue+doi normalized; Generated synopsis; Keyword enriched,pending external lookup,,No duplicate flag,"This paper appears to address investigative workflow within the broader area of investigative workflows & collaboration. It likely develops or evaluates methods, workflows, or analytical models that support OSINT-enabled cybersecurity research or operational investigation. Relevant domains include Intelligence Services; Law Enforcement; Penetration Testing.",OSINT; Social media; Intelligence Services; Law Enforcement; Penetration Testing; Malicious infrastructure; Investigative Workflows Collaboration; Investigative Workflow,,,,False,Standard,,,,,,,,,,,,,,,,,,,
Automating the Detection of Cyberstalking,,2021.0,IEEE,Cyber Threat Intelligence,CTI,Law enforcement,Social Media,cyber threat intelligence; social media; cyber harassment,https://ieeexplore.ieee.org/document/9532858/,Browne OSINT+AI review dataset (Included/Collected Data); bibliographic normalization pending,Expanded,,venue normalized; Generated synopsis; Keyword enriched,pending external lookup,,No duplicate flag,"This paper appears to address cti within the broader area of cyber threat intelligence. It likely focuses on detecting, classifying, or predicting security-relevant events or indicators from open or semi-open data sources. Relevant domains include Law enforcement.",Cyber threat intelligence; Social media; Cyber harassment; Law enforcement; CTI,,,,False,Standard,,,,,,,,,,,,,,,,,,,
"Coronavirus fake news detection via MedOSINT check in health care official bulletins with CBR explanation: The way to find the real information source through OSINT, the verifier tool for official journals",,2021.0,Elsevier / ScienceDirect,Cyber Threat Intelligence,CTI,Goverment Departments; Public Health; Intelligence Services,Social Media; Online News,OSINT; cyber threat intelligence; social media; misinformation,https://doi.org/10.1016/j.ins.2021.05.074,Browne OSINT+AI review dataset (Included/Collected Data); bibliographic normalization pending,Expanded,10.1016/j.ins.2021.05.074,venue+doi normalized; Generated synopsis; Keyword enriched,pending external lookup,,No duplicate flag,"This paper appears to address cti within the broader area of cyber threat intelligence. It likely focuses on detecting, classifying, or predicting security-relevant events or indicators from open or semi-open data sources. Relevant domains include Goverment Departments; Public Health; Intelligence Services.",OSINT; Cyber threat intelligence; Social media; Misinformation; Goverment Departments; Public Health; Intelligence Services; Online News; CTI,,,,False,Standard,,,,,,,,,,,,,,,,,,,
User-level sentiment analysis incorporating social networks,,2011.0,ACM Digital Library,Investigative Workflows & Collaboration,Other,General,Social Media,social media; network analysis,https://dl.acm.org/doi/abs/10.1145/2020408.2020614?casa_token=I-FVSP48AIQAAAAA:Pme1m8MbFZS3kqn3LtgaggUi2b784nHSSe6RgFmLNqN-aRoBBkt97wQLLTouyY00hfsxQuLnODJt,Browne OSINT+AI review dataset (Included/Collected Data); bibliographic normalization pending,Expanded,10.1145/2020408.2020614,venue+doi normalized; Generated synopsis; Keyword enriched,pending external lookup,,No duplicate flag,"This paper appears to address other within the broader area of investigative workflows & collaboration. It likely develops or evaluates methods, workflows, or analytical models that support OSINT-enabled cybersecurity research or operational investigation. Relevant domains include General.",Social media; Network analysis; General; Investigative Workflows Collaboration; Other,,,,False,Standard,,,,,,,,,,,,,,,,,,,
Classification of colloquial Arabic tweets in real-time to detect high-risk floods,,2017.0,IEEE,Cyber Threat Intelligence,CTI,Law Enforcement; Emergency Services,Social Media,cyber threat intelligence; social media,https://ieeexplore.ieee.org/document/8057358/,Browne OSINT+AI review dataset (Included/Collected Data); bibliographic normalization pending,Expanded,,venue normalized; Generated synopsis; Keyword enriched,pending external lookup,,No duplicate flag,"This paper appears to address cti within the broader area of cyber threat intelligence. It likely focuses on detecting, classifying, or predicting security-relevant events or indicators from open or semi-open data sources. Relevant domains include Law Enforcement; Emergency Services.",Cyber threat intelligence; Social media; Law Enforcement; Emergency Services; CTI,,,,False,Standard,,,,,,,,,,,,,,,,,,,
EEQuest: An Event Extraction and Query System,,2016.0,ACM Digital Library,Cyber Threat Intelligence,CTI,General,Online News,cyber threat intelligence,https://dl.acm.org/doi/10.1145/2998476.2998482,Browne OSINT+AI review dataset (Included/Collected Data); bibliographic normalization pending,Expanded,10.1145/2998476.2998482,venue+doi normalized; Generated synopsis; Keyword enriched,pending external lookup,,No duplicate flag,"This paper appears to address cti within the broader area of cyber threat intelligence. It likely contributes to threat intelligence collection, indicator extraction, or vulnerability-focused analysis using open-source data. Relevant domains include General.",Cyber threat intelligence; General; Online News; CTI,,,,False,Standard,,,,,,,,,,,,,,,,,,,
FaceWallGraph: Using Machine Learning for Profiling User Behaviour from Facebook Wall,,2019.0,Springer,Social Media & OSINT Collection,Other,Law enforcement; Intelligence Services,Social Media,social media,http://dx.doi.org/10.1007/978-3-030-30859-9_11,Browne OSINT+AI review dataset (Included/Collected Data); bibliographic normalization pending,Expanded,10.1007/978-3-030-30859-9_11,venue+doi normalized; Generated synopsis; Keyword enriched,pending external lookup,,No duplicate flag,"This paper appears to address other within the broader area of social media & osint collection. It likely develops or evaluates methods, workflows, or analytical models that support OSINT-enabled cybersecurity research or operational investigation. Relevant domains include Law enforcement; Intelligence Services.",Social media; Law enforcement; Intelligence Services; AI; Social Media OSINT Collection; Other,,,,False,Standard,,,,,,,,,,,,,,,,,,,
DataStories at SemEval-2017 Task 4: Deep LSTM with Attention for Message-level and Topic-based Sentiment Analysis,,2017.0,ACL Anthology,Social Media & OSINT Collection,Other,General,Social Media,social media,https://aclanthology.org/S17-2126/,Browne OSINT+AI review dataset (Included/Collected Data); bibliographic normalization pending,Expanded,,venue normalized; Generated synopsis; Keyword enriched,pending external lookup,,No duplicate flag,"This paper appears to address other within the broader area of social media & osint collection. It likely develops or evaluates methods, workflows, or analytical models that support OSINT-enabled cybersecurity research or operational investigation. Relevant domains include General.",Social media; General; Social Media OSINT Collection; Other,,,,False,Standard,,,,,,,,,,,,,,,,,,,
Sentiment Analysis of Media in German on the Refugee Crisis in Europe,,2016.0,Springer,Social Media & OSINT Collection,Other,Intelligence Services; Non-Goverment Organisations; Goverment Departments; Law Enforcement,Social Media; Web Pages; Web Feeds,social media,http://link.springer.com/10.1007/978-3-319-47093-1,Browne OSINT+AI review dataset (Included/Collected Data); bibliographic normalization pending,Expanded,10.1007/978-3-319-47093-1,venue+doi normalized; Generated synopsis; Keyword enriched,pending external lookup,,No duplicate flag,"This paper appears to address other within the broader area of social media & osint collection. It likely develops or evaluates methods, workflows, or analytical models that support OSINT-enabled cybersecurity research or operational investigation. Relevant domains include Intelligence Services; Non-Goverment Organisations; Goverment Departments; Law Enforcement.",Social media; Intelligence Services; Non-Goverment Organisations; Goverment Departments; Law Enforcement; Web Pages; Web Feeds; Social Media OSINT Collection; Other,,,,False,Standard,,,,,,,,,,,,,,,,,,,
Machine Learning-Based Sentiment Analysis for Twitter Accounts,,2018.0,MDPI,Social Media & OSINT Collection,SOCMINT,General,Social Media,social media,https://www.mdpi.com/2297-8747/23/1/11,Browne OSINT+AI review dataset (Included/Collected Data); bibliographic normalization pending,Expanded,10.3390/mca23010011,venue normalized; DOI completed; Generated synopsis; Keyword enriched,pending external lookup,,No duplicate flag,"This paper appears to address socmint within the broader area of social media & osint collection. It likely studies how social-media or open-web sources can be exploited for monitoring, attribution, event discovery, or narrative analysis in security contexts. Relevant domains include General.",Social media; General; AI; Social Media OSINT Collection; SOCMINT,,,,False,Standard,,,,,,,,,,,,,,,,,,,
Using soft-hard fusion for misinformation detection and pattern of life analysis in OSINT,,2017.0,,Cyber Threat Intelligence,CTI,Intelligence Services; Goverment Departments; Law Enforcement,Online dataset; News Articles,OSINT; cyber threat intelligence; misinformation,https://www.spiedigitallibrary.org/conference-proceedings-of-spie/10207/1020704/Using-soft-hard-fusion-for-misinformation-detection-and-pattern-of/10.1117/12.2263546.short,Browne OSINT+AI review dataset (Included/Collected Data); bibliographic normalization pending,Expanded,10.1117/12.2263546.short,doi normalized; Generated synopsis; Keyword enriched,pending external lookup,,No duplicate flag,"This paper appears to address cti within the broader area of cyber threat intelligence. It likely focuses on detecting, classifying, or predicting security-relevant events or indicators from open or semi-open data sources. Relevant domains include Intelligence Services; Goverment Departments; Law Enforcement.",OSINT; Cyber threat intelligence; Misinformation; Intelligence Services; Goverment Departments; Law Enforcement; Online dataset; News Articles; CTI,,,,False,Standard,,,,,,,,,,,,,,,,,,,
Supervised machine learning for the detection of troll profiles in twitter social network: application to a real case of cyberbullying,,2015.0,ResearchGate,Cyber Threat Intelligence,CTI,Intelligence Services; Law Enforcement; Non-Goverment Organisations,Social Media,cyber threat intelligence; social media; cyber harassment; network analysis,https://www.researchgate.net/publication/303427795_Supervised_machine_learning_for_the_detection_of_troll_profiles_in_twitter_social_network_Application_to_a_real_case_of_cyberbullying,Browne OSINT+AI review dataset (Included/Collected Data); bibliographic normalization pending,Expanded,,venue normalized; Generated synopsis; Keyword enriched,pending external lookup,,No duplicate flag,"This paper appears to address cti within the broader area of cyber threat intelligence. It likely focuses on detecting, classifying, or predicting security-relevant events or indicators from open or semi-open data sources. Relevant domains include Intelligence Services; Law Enforcement; Non-Goverment Organisations.",Cyber threat intelligence; Social media; Cyber harassment; Network analysis; Intelligence Services; Law Enforcement; Non-Goverment Organisations; CTI; AI,,,,False,Standard,,,,,,,,,,,,,,,,,,,
Detecting predatory conversations in social media by deep Convolutional Neural Networks,,2016.0,Elsevier / ScienceDirect,Cyber Threat Intelligence,CTI,Law enforcement; Non-Goverment Organisations,Social Media; Online dataset,cyber threat intelligence; social media,https://www.sciencedirect.com/science/article/pii/S1742287616300731?casa_token=F1ejjsMcqWgAAAAA:CldqDS41Lr3lUwhdx65sNAUyfP4aIjSgI8_ZVEWGWV9dEk0AGAIz0EOY6dhiQlAhkBPFNn-0EA,Browne OSINT+AI review dataset (Included/Collected Data); bibliographic normalization pending,Expanded,10.1016/j.diin.2016.07.001,venue normalized; DOI completed; Generated synopsis; Keyword enriched,pending external lookup,,No duplicate flag,"This paper appears to address cti within the broader area of cyber threat intelligence. It likely contributes to threat intelligence collection, indicator extraction, or vulnerability-focused analysis using open-source data. Relevant domains include Law enforcement; Non-Goverment Organisations.",Cyber threat intelligence; Social media; Law enforcement; Non-Goverment Organisations; Online dataset; CTI; Network analysis,,,,False,Standard,,,,,,,,,,,,,,,,,,,
Would Your Tweet Invoke Hate on the Fly? Forecasting Hate Intensity of Reply Threads on Twitter,,2021.0,ACM Digital Library,Threat Detection & Prediction,SOCMINT,Law enforcement; Intelligence Services; Non-Goverment Organisations; Goverment Departments,Social Media,social media; hate speech,https://dl.acm.org/doi/abs/10.1145/3447548.3467150,Browne OSINT+AI review dataset (Included/Collected Data); bibliographic normalization pending,Expanded,10.1145/3447548.3467150,venue+doi normalized; Generated synopsis; Keyword enriched,pending external lookup,,No duplicate flag,"This paper appears to address socmint within the broader area of threat detection & prediction. It likely studies how social-media or open-web sources can be exploited for monitoring, attribution, event discovery, or narrative analysis in security contexts. Relevant domains include Law enforcement; Intelligence Services; Non-Goverment Organisations; Goverment Departments.",Social media; Hate speech; Law enforcement; Intelligence Services; Non-Goverment Organisations; Goverment Departments; Threat Detection Prediction; SOCMINT,,,,False,Standard,,,,,,,,,,,,,,,,,,,
Open Source Intelligence Initiating Efficient Investigation and Reliable Web Searching,,2019.0,Springer,Investigative Workflows & Collaboration,Investigative Workflow,Law enforcement; Intelligence Services; Penetration Testing,Not Specified,OSINT,http://dx.doi.org/10.1007/978-981-15-6634-9_15,Browne OSINT+AI review dataset (Included/Collected Data); bibliographic normalization pending,Expanded,10.1007/978-981-15-6634-9_15,venue+doi normalized; Generated synopsis; Keyword enriched,pending external lookup,,No duplicate flag,"This paper appears to address investigative workflow within the broader area of investigative workflows & collaboration. It likely develops or evaluates methods, workflows, or analytical models that support OSINT-enabled cybersecurity research or operational investigation. Relevant domains include Law enforcement; Intelligence Services; Penetration Testing.",OSINT; Law enforcement; Intelligence Services; Penetration Testing; Not Specified; Investigation workflow; Investigative Workflows Collaboration; Investigative Workflow,,,,False,Standard,,,,,,,,,,,,,,,,,,,
Automatic classification of social media reports on violent incidents in South Africa using machine learning,,2020.0,,Threat Detection & Prediction,SOCMINT,Law enforcement; Intelligence Services,Social Media,social media,https://sajs.co.za/article/view/6557,Browne OSINT+AI review dataset (Included/Collected Data); bibliographic normalization pending,Expanded,,partial / pending; Generated synopsis; Keyword enriched,pending external lookup,,No duplicate flag,"This paper appears to address socmint within the broader area of threat detection & prediction. It likely focuses on detecting, classifying, or predicting security-relevant events or indicators from open or semi-open data sources. Relevant domains include Law enforcement; Intelligence Services.",Social media; Law enforcement; Intelligence Services; AI; Threat Detection Prediction; SOCMINT,,,,False,Standard,,,,,,,,,,,,,,,,,,,
