title,authors,year,venue,Category,Investigation_Type,Domains,OSINT_Source_Types,Tags,source_url,Provenance,Priority,doi,Metadata_Status,Author_List_Status,Potential_Duplicate_Group,Dedup_Recommendation,abstract,Keywords,Harvest_Source,Abstract_Source_Status,Harvest_Source_URL,Seminal_Flag,Quality_Tier,discovery_source,discovery_query,inclusion_path,citation_count,reference_count,affiliations,candidate_id,scored_at,venue_score,citation_score,institution_score,institution_bonus,relevance_score,total_quality_score,review_reason,recommended_action,harvest_source,is_preprint,rescore_run_id
Machine Learning-Enabled IoT Security: Open Issues and Challenges Under Advanced Persistent Threats,Zhiyan Chen; Jinxin Liu; Yu Shen; Murat Simsek; Burak Kantarci; Hussein T. Mouftah; Petar Djukic,2022.0,ACM Computing Surveys,Other,Other,,,,https://doi.org/10.1145/3530812,,,10.1145/3530812,,,,,"Despite its technological benefits, the Internet of Things (IoT) has cyber weaknesses due to vulnerabilities in the wireless medium. Machine Larning (ML)-based methods are widely used against cyber threats in IoT networks with promising performance. An Advanced Persistent Threat (APT) is prominent for cybercriminals to compromise networks, and it is crucial to long-term and harmful characteristics. However, it is difficult to apply ML-based approaches to identify APT attacks to obtain a promising detection performance due to an extremely small percentage among normal traffic. There are limited surveys that fully investigate APT attacks in IoT networks due to the lack of public datasets with all types of APT attacks. It is worth bridging the state of the art in network attack detection with APT attack detection in a comprehensive review article. This survey article reviews the security challenges in IoT networks and presents well-known attacks, APT attacks, and threat models in IoT systems. Meanwhile, signature-based, anomaly-based, and hybrid intrusion detection systems are summarized for IoT networks. The article highlights statistical insights regarding frequently applied ML-based methods against network intrusion. Finally, open issues and challenges for common network intrusion and APT attacks are presented for future research.",,,,,False,Standard,OpenAlex,advanced persistent threats,discovery,136.0,181.0,,819.0,2026-04-25T00:54:24.229093+00:00,100.0,100.0,20.0,0.0,100.0,100.0,,auto-include,Crossref DOI,False,e6c60acfac0d436bb90b37f5043bcfd1
A New Proposal on the Advanced Persistent Threat: A Survey,Santiago Quintero-Bonilla; Angel Martín del Rey,2020.0,Applied Sciences,Other,Other,,,,https://doi.org/10.3390/app10113874,,,10.3390/app10113874,,,,,"An advanced persistent threat (APT) can be defined as a targeted and very sophisticated cyber attack. IT administrators need tools that allow for the early detection of these attacks. Several approaches have been proposed to provide solutions to this problem based on the attack life cycle. Recently, machine learning techniques have been implemented in these approaches to improve the problem of detection. This paper aims to propose a new approach to APT detection, using machine learning techniques, and is based on the life cycle of an APT attack. The proposed model is organised into two passive stages and three active stages to adapt the mitigation techniques based on machine learning.",,,,,False,Standard,OpenAlex,advanced persistent threats,discovery,75.0,60.0,,820.0,2026-04-25T00:54:24.229093+00:00,40.0,93.84,20.0,0.0,62.5,67.16,,auto-include,Crossref DOI,False,e6c60acfac0d436bb90b37f5043bcfd1
RAIN: Refinable Attack Investigation with On-demand Inter-Process Information Flow Tracking,Yang Ji; Sangho Lee; Evan Downing; Weiren Wang; Mattia Fazzini; Taesoo Kim; Alessandro Orso; Wenke Lee,2017.0,Proceedings of the 2017 ACM SIGSAC Conference on Computer and Communications Security,Other,Other,,,,https://doi.org/10.1145/3133956.3134045,,,10.1145/3133956.3134045,,,,,,,,,,False,Standard,Semantic Scholar citation chain,HOLMES: Real-Time APT Detection through Correlation of Suspicious Information Flows,backward chaining,119.0,0.0,,863.0,2026-04-25T00:54:24.229093+00:00,100.0,100.0,20.0,0.0,12.5,78.12,,auto-include,Crossref DOI,False,e6c60acfac0d436bb90b37f5043bcfd1
Advanced Persistent Threat Detection Using Data Provenance and Metric Learning,Khandakar Ashrafi Akbar; Yigong Wang; Gbadebo Ayoade; Yang Gao; Anoop Singhal; Latifur Khan; Bhavani Thuraisingham; Kangkook Jee,2023.0,IEEE Transactions on Dependable and Secure Computing,Other,Other,,,,https://doi.org/10.1109/tdsc.2022.3221789,,,10.1109/tdsc.2022.3221789,,,,,"Advanced persistent threats (APT) have increased in recent times as a result of the rise in interest by nation-states and sophisticated corporations to obtain high-profile information. Typically, APT attacks are more challenging to detect since they leverage zero-day attacks and common benign tools. Furthermore, these attack campaigns are often prolonged to evade detection. We leverage an approach that uses a provenance graph to obtain execution traces of host nodes in order to detect anomalous behavior. By using the provenance graph, we extract features that are then used to train an online adaptive metric learning. Online metric learning is a deep learning method that learns a function to minimize the separation between similar classes and maximizes the separation between dis- similar instances. We compare our approach with baseline models and we show our method outperforms the baseline models by increasing detection accuracy on average by 11.3% and increases True positive rate (TPR) on average by 18.3%. We also show that our method outperforms several state-of-the-art models performances in comprehensive attack datasets in both binary and multi-class settings.",,,,,False,Standard,Semantic Scholar citation chain,A Study on Advanced Persistent Threats,backward chaining,23.0,0.0,,864.0,2026-04-25T00:54:24.229093+00:00,100.0,68.86,20.0,0.0,75.0,81.29,,auto-include,Crossref DOI,False,e6c60acfac0d436bb90b37f5043bcfd1
Experimental Investigation and Numerical Simulation on the Crack Initiation and Propagation of Rock With Pre-Existing Cracks,Xun Xi; Xu Wu; Qifeng Guo; Meifeng Cai,2020.0,IEEE Access,Other,Other,,,,https://doi.org/10.1109/access.2020.3009230,,,10.1109/access.2020.3009230,,,,,"Rock mass behavior is determined not only by the properties of the rock matrix but also mostly by the pre-existing cracks in the rock mass. Before the overall failure of rock, the crack initiation and propagation around the tip of pre-existing cracks (i.e., pre-crack) will occur and contribute to rock failure. In this paper, the deep granite from a gold mine is taken and made to specimens with the pre-crack of 0.3 mm thickness. Uniaxial compression tests are carried out on the pre-cracked specimens. The acoustic emission (AE) sensors and digital image correlation (DIC) system are employed to record the failure characteristics of the specimens. The extended finite element method (XFEM) with the non-local stress field calculation is used to simulate the crack initiation and propagation of pre-cracks. The crack patterns, opening and shearing displacements of the cracked surface, and the crack length development are obtained from numerical simulations. Finally, the effects of friction of crack surface on the crack pattern and crack propagation are investigated and discussed. It has been found that, for pre-cracked specimens, crack initiation and propagation will occur when the stress is much smaller than the rock compressive strength. And in the range of pre-crack angle 30-60°, the larger the pre-crack angle is, the larger the compressive strength is. The crack patterns from numerical simulations have a good agreement with those from experimented DIC results. Moreover, the order of crack propagation speed is consistent with the order of the compressive strength. The crack pattern and crack propagation are affected by the friction coefficient of the cracked surface.",,,,,False,Standard,Semantic Scholar citation chain,Experimental investigation of progressive cracking processes in granite under uniaxial loading using digital imaging and AE techniques,backward chaining,49.0,0.0,,865.0,2026-04-25T00:54:24.229093+00:00,100.0,84.77,20.0,0.0,37.5,78.28,,auto-include,Crossref DOI,False,e6c60acfac0d436bb90b37f5043bcfd1
"ChatGPT for Education and Research: Opportunities, Threats, and Strategies",Md. Mostafizer Rahman; Yutaka Watanobe,2023.0,Applied Sciences,Other,Other,,,,https://doi.org/10.3390/app13095783,,,10.3390/app13095783,,,,,"In recent years, the rise of advanced artificial intelligence technologies has had a profound impact on many fields, including education and research. One such technology is ChatGPT, a powerful large language model developed by OpenAI. This technology offers exciting opportunities for students and educators, including personalized feedback, increased accessibility, interactive conversations, lesson preparation, evaluation, and new ways to teach complex concepts. However, ChatGPT poses different threats to the traditional education and research system, including the possibility of cheating on online exams, human-like text generation, diminished critical thinking skills, and difficulties in evaluating information generated by ChatGPT. This study explores the potential opportunities and threats that ChatGPT poses to overall education from the perspective of students and educators. Furthermore, for programming learning, we explore how ChatGPT helps students improve their programming skills. To demonstrate this, we conducted different coding-related experiments with ChatGPT, including code generation from problem descriptions, pseudocode generation of algorithms from texts, and code correction. The generated codes are validated with an online judge system to evaluate their accuracy. In addition, we conducted several surveys with students and teachers to find out how ChatGPT supports programming learning and teaching. Finally, we present the survey results and analysis.",,,,,True,Standard,Semantic Scholar,online threats,discovery,847.0,,,886.0,2026-04-25T00:54:24.229093+00:00,40.0,100.0,20.0,0.0,87.5,75.88,,auto-include,Crossref DOI,False,e6c60acfac0d436bb90b37f5043bcfd1
Generative Language Models and Automated Influence Operations: Emerging Threats and Potential Mitigations,Josh A. Goldstein; G. Sastry; Micah Musser; Renée DiResta; M. Gentzel; Katerina Sedova,2023.0,arXiv.org,Other,Other,,,,https://www.semanticscholar.org/paper/c9ad9d69d7568110dd5527598a92c7f8b335eef4,,,10.48550/arXiv.2301.04246,,,,,"Generative language models have improved drastically, and can now produce realistic text outputs that are difficult to distinguish from human-written content. For malicious actors, these language models bring the promise of automating the creation of convincing and misleading text for use in influence operations. This report assesses how language models might change influence operations in the future, and what steps can be taken to mitigate this threat. We lay out possible changes to the actors, behaviors, and content of online influence operations, and provide a framework for stages of the language model-to-influence operations pipeline that mitigations could target (model construction, model access, content dissemination, and belief formation). While no reasonable mitigation can be expected to fully prevent the threat of AI-enabled influence operations, a combination of multiple mitigations may make an important difference.",,,,,False,Standard,Semantic Scholar,online threats,discovery,314.0,,,889.0,2026-04-25T00:54:24.229093+00:00,40.0,100.0,20.0,0.0,37.5,63.38,,auto-include,,False,e6c60acfac0d436bb90b37f5043bcfd1
"Threats, Challenges, And Opportunities for Open Universities and Massive Online Open Courses in The Digital Revolution",Maria Nascimento Cunha; Tinashe Chuchu; Eugine Tafadzwa Maziriri,2020.0,International Journal of Emerging Technologies in Learning (iJET),Other,Other,,,,https://doi.org/10.3991/ijet.v15i12.13435,,,10.3991/ijet.v15i12.13435,,,,,"In a world of sharp transformation driven by digital technologies, education is facing a paradigm shift that exposes vulnerabilities and threats of Open Education models in the face of the trend of commodification. This article seeks to offer useful insights into the threats, challenges, and opportunities for open universities and massive online open courses in the digital revolution. The methodology fol-lowed a systematic content review of literature. With the advent of the internet, we have verified a profound transformation in the way we communicate and produce within the academics. The digital revolution favored the freedom of access to information. The digital revolution poses challenges but also opens up unprecedented opportunities for democratization and accessibility. The transformation process of open universities has to maintain the referential of the profound incorporation of pedagogical and technological innovation based on research and seek new strategies of organization and definition of quality, to guarantee its relevance and leadership in the pursuit of the massification of higher education.",,,,,False,Standard,Semantic Scholar,online threats,discovery,45.0,,,890.0,2026-04-25T00:54:24.229093+00:00,40.0,82.96,20.0,0.0,100.0,72.18,,auto-include,Crossref DOI,False,e6c60acfac0d436bb90b37f5043bcfd1
Survey of Online Social Networks Threats and Solutions,Muneer Bani Yassein; Shadi Aljawarneh; Yarub A. Wahsheh,2019.0,2019 IEEE Jordan International Joint Conference on Electrical Engineering and Information Technology (JEEIT),Other,Other,,,,https://doi.org/10.1109/jeeit.2019.8717381,,,10.1109/jeeit.2019.8717381,,,,,"In the last few years, a new form of Internet-based services has started, which is called Online Social Networks (OSNs). The impact of OSNs on human lives is foreseen to be very large with unprecedented amount of data and users. OSN users share their ideas, photos, daily life events, feelings and news. Since OSNs’ security and privacy challenges are more potential than ever before, it is necessary to enhance the protection and filtering approaches of OSNs contents. This paper provides a comprehensive analysis of OSNs’ threats and challenges, and categorize them into: account-based, URL-based and content-based threats. We analyze the existing protection methods and highlight their limitations and weaknesses. Finally, we provide a set of recommendations for a security system that fill the gaps of the currently applied methods.",,,,,False,Standard,Semantic Scholar,online threats,discovery,53.0,,,891.0,2026-04-25T00:54:24.229093+00:00,100.0,86.43,20.0,0.0,75.0,88.32,,auto-include,Crossref DOI,False,e6c60acfac0d436bb90b37f5043bcfd1
Web Queries as a Source for Syndromic Surveillance,Anette Hulth; Gustaf Rydevik; Annika Linde,2009.0,PLoS ONE,Other,Other,,,,https://doi.org/10.1371/journal.pone.0004378,,,10.1371/journal.pone.0004378,,,,,"In the field of syndromic surveillance, various sources are exploited for outbreak detection, monitoring and prediction. This paper describes a study on queries submitted to a medical web site, with influenza as a case study. The hypothesis of the work was that queries on influenza and influenza-like illness would provide a basis for the estimation of the timing of the peak and the intensity of the yearly influenza outbreaks that would be as good as the existing laboratory and sentinel surveillance. We calculated the occurrence of various queries related to influenza from search logs submitted to a Swedish medical web site for two influenza seasons. These figures were subsequently used to generate two models, one to estimate the number of laboratory verified influenza cases and one to estimate the proportion of patients with influenza-like illness reported by selected General Practitioners in Sweden. We applied an approach designed for highly correlated data, partial least squares regression. In our work, we found that certain web queries on influenza follow the same pattern as that obtained by the two other surveillance systems for influenza epidemics, and that they have equal power for the estimation of the influenza burden in society. Web queries give a unique access to ill individuals who are not (yet) seeking care. This paper shows the potential of web queries as an accurate, cheap and labour extensive source for syndromic surveillance.",,,,,False,Standard,Semantic Scholar citation chain,"Infodemiology and Infoveillance: Framework for an Emerging Set of Public Health Informatics Methods to Analyze Search, Communication and Publication Behavior on the Internet",backward chaining,239.0,0.0,,898.0,2026-04-25T00:54:24.229093+00:00,40.0,100.0,20.0,0.0,25.0,60.25,,auto-include,Crossref DOI,False,e6c60acfac0d436bb90b37f5043bcfd1
Big Data Analytics: A Survey,Wasnaa Kadhim Jawad; Abbas M. Al-Bakry,2022.0,Iraqi Journal for Computers and Informatics,Other,Other,,,,https://doi.org/10.25195/ijci.v49i1.384,,,10.25195/ijci.v49i1.384,,,,,"Internet-based programs and communication techniques have become widely used and respected in the IT industry recently. A persistent source of ""big data,"" or data that is enormous in volume, diverse in type, and has a complicated multidimensional structure, is internet applications and communications. Today, several measures are routinely performed with no assurance that any of them will be helpful in understanding the phenomenon of interest in an era of automatic, large-scale data collection. Online transactions that involve buying, selling, or even investing are all examples of e-commerce. As a result, they generate data that has a complex structure and a high dimension. The usual data storage techniques cannot handle those enormous volumes of data. There is a lot of work being done to find ways to minimize the dimensionality of big data in order to provide analytics reports that are even more accurate and data visualizations that are more interesting. As a result, the purpose of this survey study is to give an overview of big data analytics along with related problems and issues that go beyond technology.",,,,,False,Standard,Semantic Scholar citation chain,Cybersecurity data science: an overview from machine learning perspective,backward chaining,420.0,0.0,,900.0,2026-04-25T00:54:24.229093+00:00,40.0,100.0,20.0,0.0,75.0,72.75,,auto-include,Crossref DOI,False,e6c60acfac0d436bb90b37f5043bcfd1
IntruDTree: A Machine Learning Based Cyber Security Intrusion Detection Model,Iqbal H. Sarker; Yoosef B. Abushark; Fawaz Alsolami; Asif Irshad Khan,2020.0,MDPI AG,Other,Other,,,,https://doi.org/10.20944/preprints202004.0481.v1,,,10.20944/preprints202004.0481.v1,,,,,"Cyber security has recently received enormous attention in today&rsquo;s security concerns, due to the popularity of the Internet-of-Things (IoT), the tremendous growth of computer networks, and the huge number of relevant applications. Thus, detecting various cyber-attacks or anomalies in a network and building an effective intrusion detection system that performs an essential role in today&rsquo;s security is becoming more important. Artificial intelligence, particularly machine learning techniques, can be used for building such a data-driven intelligent intrusion detection system. In order to achieve this goal, in this paper, we present an Intrusion Detection Tree (&ldquo;IntruDTree&rdquo;) machine-learning-based security model that first takes into account the ranking of security features according to their importance and then build a tree-based generalized intrusion detection model based on the selected important features. This model is not only effective in terms of prediction accuracy for unseen test cases but also minimizes the computational complexity of the model by reducing the feature dimensions. Finally, the effectiveness of our IntruDTree model was examined by conducting experiments on cybersecurity datasets and computing the precision, recall, fscore, accuracy, and ROC values to evaluate. We also compare the outcome results of IntruDTree model with several traditional popular machine learning methods such as the naive Bayes classifier, logistic regression, support vector machines, and k-nearest neighbor, to analyze the effectiveness of the resulting security model.",,,,,False,Standard,Semantic Scholar citation chain,Cybersecurity data science: an overview from machine learning perspective,backward chaining,255.0,0.0,,901.0,2026-04-25T00:54:24.229093+00:00,40.0,100.0,20.0,0.0,62.5,69.62,,auto-include,Crossref DOI,False,e6c60acfac0d436bb90b37f5043bcfd1
CyberLearning: Effectiveness Analysis of Machine Learning Security Modeling to Detect Cyber-Anomalies and Multi-Attacks,Iqbal H. Sarker,2021.0,Internet of Things,Other,Other,,,,https://doi.org/10.1016/j.iot.2021.100393,,,10.1016/j.iot.2021.100393,,,,,"Abstract Detecting cyber-anomalies and attacks are becoming a rising concern these days in the domain of cybersecurity. The knowledge of artificial intelligence, particularly, the machine learning techniques can be used to tackle these issues. However, the effectiveness of a learning-based security model may vary depending on the security features and the data characteristics. In this paper, we present “CyberLearning”, a machine learning-based cybersecurity modeling with correlated-feature selection, and a comprehensive empirical analysis on the effectiveness of various machine learning based security models. In our CyberLearning modeling, we take into account a binary classification model for detecting anomalies , and multi-class classification model for various types of cyber-attacks. To build the security model, we first employ the popular ten machine learning classification techniques , such as naive Bayes, Logistic regression, Stochastic gradient descent , K-nearest neighbors, Support vector machine, Decision Tree, Random Forest, Adaptive Boosting, eXtreme Gradient Boosting, as well as Linear discriminant analysis. We then present the artificial neural network-based security model considering multiple hidden layers. The effectiveness of these learning-based security models is examined by conducting a range of experiments utilizing the two most popular security datasets, UNSW-NB15 and NSL-KDD. Overall, this paper aims to serve as a reference point for data-driven security modeling through our experimental analysis and findings in the context of cybersecurity.",,,,,False,Standard,Semantic Scholar citation chain,Cybersecurity data science: an overview from machine learning perspective,backward chaining,96.0,0.0,,902.0,2026-04-25T00:54:24.229093+00:00,40.0,99.12,20.0,0.0,50.0,66.15,,auto-include,Crossref DOI,False,e6c60acfac0d436bb90b37f5043bcfd1
Spatiotemporal social media analytics for abnormal event detection and examination using seasonal-trend decomposition,Junghoon Chae; Dennis Thom; Harald Bosch; Yun Jang; Ross Maciejewski; David S. Ebert; Thomas Ertl,2012.0,2012 IEEE Conference on Visual Analytics Science and Technology (VAST),Other,Other,,,,https://doi.org/10.1109/vast.2012.6400557,,,10.1109/vast.2012.6400557,,,,,,,,,,False,Standard,Semantic Scholar citation chain,Social Media Analytics and Intelligence,backward chaining,297.0,0.0,,973.0,2026-04-25T00:54:24.229093+00:00,100.0,100.0,20.0,0.0,25.0,81.25,,auto-include,Crossref DOI,False,e6c60acfac0d436bb90b37f5043bcfd1
Nonreciprocity Compensation Combined With Turbo Codes for Secret Key Generation in Vehicular Ad Hoc Social IoT Networks,Gregory Epiphaniou; Petros Karadimas; Dhouha Kbaier Ben Ismail; Haider Al-Khateeb; Ali Dehghantanha; Kim-Kwang Raymond Choo,2018.0,IEEE Internet of Things Journal,Other,Other,,,,https://doi.org/10.1109/jiot.2017.2764384,,,10.1109/jiot.2017.2764384,,,,,"The physical attributes of the dynamic vehicle-to-vehicle propagation channel can be utilized for the generation of highly random and symmetric cryptographic keys. However, in a physical-layer key agreement scheme, nonreciprocity due to inherent channel noise and hardware impairments can propagate bit disagreements. This has to be addressed prior to the symmetric key generation which is inherently important in Social Internet of Things networks, including in adversarial settings (e.g., battlefields). In this paper, we parametrically incorporate temporal variability attributes, such as 3-D scattering and scatterers’ mobility. Accordingly, this is the first work to incorporate such features into the key generation process by combining nonreciprocity compensation with turbo codes (TCs). Preliminary results indicate a significant improvement when using TCs in bit mismatch rate and key generation rate in comparison to sample indexing techniques.",,,,,False,Standard,Semantic Scholar citation chain,Detection of advanced persistent threat using machine-learning correlation analysis,backward chaining,44.0,0.0,,977.0,2026-04-25T00:54:24.229093+00:00,100.0,82.48,20.0,0.0,37.5,77.37,,auto-include,Crossref DOI,False,e6c60acfac0d436bb90b37f5043bcfd1
