title,authors,year,venue,Category,Investigation_Type,Domains,OSINT_Source_Types,Tags,source_url,Provenance,Priority,doi,Metadata_Status,Author_List_Status,Potential_Duplicate_Group,Dedup_Recommendation,abstract,Keywords,Harvest_Source,Abstract_Source_Status,Harvest_Source_URL,Seminal_Flag,Quality_Tier,discovery_source,discovery_query,inclusion_path,citation_count,reference_count,affiliations,candidate_id,scored_at,venue_score,citation_score,institution_score,institution_bonus,relevance_score,total_quality_score,review_reason,recommended_action,harvest_source,is_preprint,rescore_run_id
KnowCTI: Knowledge-based Cyber Threat Intelligence Extraction,Wang et al.,2024.0,,Cyber Threat Intelligence,CTI,Other,,cyber threat intelligence; CTI NLP,,Legacy_40 seed list; bibliographic normalization pending,Expanded,,partial / pending; Generated synopsis; Keyword enriched,normalized existing list,,No duplicate flag,"This paper appears to address cti within the broader area of cyber threat intelligence. It likely contributes to threat intelligence collection, indicator extraction, or vulnerability-focused analysis using open-source data. Relevant domains include Other.",Cyber threat intelligence; CTI NLP; Other; CTI; Threat intelligence,,,,False,Standard,,,,,,,,,,,,,,,,,,,
GPT-based Open Source Intelligence Using Textual Cyber-event Depictions,Sufi et al.,2024.0,,Cyber Threat Intelligence,CTI,Other,,OSINT; cyber threat intelligence; AI OSINT,,Legacy_40 seed list; bibliographic normalization pending,Expanded,,partial / pending; Generated synopsis; Keyword enriched,normalized existing list,,No duplicate flag,"This paper appears to address cti within the broader area of cyber threat intelligence. It likely contributes to threat intelligence collection, indicator extraction, or vulnerability-focused analysis using open-source data. Relevant domains include Other.",OSINT; Cyber threat intelligence; AI OSINT; Other; CTI; AI,,,,False,Standard,,,,,,,,,,,,,,,,,,,
Toward a Cognitive Linguistic Approach to the Criminal Analysis of Open Source Information,Dojčinović,2012.0,,Digital Forensics & Evidence,Digital Forensics / Evidence,Other,,linguistic analysis,,Legacy_40 seed list; bibliographic normalization pending,Expanded,,partial / pending; Generated synopsis; Keyword enriched,normalized existing list,,No duplicate flag,"This paper appears to address digital forensics / evidence within the broader area of digital forensics & evidence. It likely develops or evaluates methods, workflows, or analytical models that support OSINT-enabled cybersecurity research or operational investigation. Relevant domains include Other.",Linguistic analysis; Other; Digital Forensics Evidence,,,,False,Standard,,,,,,,,,,,,,,,,,,,
Digital Evidence and War Crimes Prosecutions,Ruth Bettina Birn,2018.0,Fordham international law journal,Digital Forensics & Evidence,Digital Forensics / Evidence,Other,,digital forensics; international law,,Legacy_40 seed list; bibliographic normalization pending,Expanded,10.2307/j.ctv47w86h.11,partial / pending; Generated synopsis; Keyword enriched; Authoritative harvest: Crossref search; OpenAlex search; OpenAlex abstract,normalized existing list,,No duplicate flag,"As technology develops, new tools are continually being introduced that alter the nature and availability of courtroom evidence.The proliferation, connectivity, and capabilities of cameraembedded and internet-enabled mobile devices, which record far more information about people's activities and communications than ever before, are transforming the way criminal investigators and prosecutors collect, evaluate, and present evidence at trial.This is particularly true in international criminal trials, where prosecutors must present a voluminous and varied body of evidence to prove multiple charges related to complex conflicts.It is the prosecutor's job to present evidence in a way that assists the fact-finder in evaluating its significance and understanding how it fits into the greater narrative.Advanced digital devices can now capture far more information about a situation than a witness can perceive, and innovative presentation tools allow lawyers to augment and strengthen the evidence in their cases by adding supplementary data and creating compelling visuals.In cases involving war crimes, crimes against humanity, and genocide, a large quantity and diversity",Digital forensics; International law; Other; Evidence; Digital Forensics Evidence,Crossref search; OpenAlex search,OpenAlex abstract,https://ir.lawnet.fordham.edu/ilj/vol41/iss2/1,False,Standard,,,,,,,,,,,,,,,,,,,
Open Source Intelligence,Felix Stalder; Jesse Hirsh,2002.0,First Monday,Other,Other,,,,https://doi.org/10.5210/fm.v7i6.961,,,10.5210/fm.v7i6.961,,,,,,,,,,False,Standard,OpenAlex,open source intelligence,discovery,86.0,4.0,,1.0,2026-04-25T00:54:24.229093+00:00,40.0,96.77,20.0,0.0,37.5,62.08,,auto-include,Crossref DOI,False,e6c60acfac0d436bb90b37f5043bcfd1
Intelligence in the internet age: The emergence and evolution of Open Source Intelligence (OSINT),Michael Glassman; Min Ju Kang,2011.0,Computers in Human Behavior,Other,Other,,,,https://doi.org/10.1016/j.chb.2011.11.014,,,10.1016/j.chb.2011.11.014,,,,,,,,,,False,Standard,OpenAlex,open source intelligence,discovery,144.0,46.0,,2.0,2026-04-25T00:54:24.229093+00:00,40.0,100.0,20.0,0.0,62.5,69.62,,auto-include,Crossref DOI,False,e6c60acfac0d436bb90b37f5043bcfd1
Defining Second Generation Open Source Intelligence (OSINT) for the Defense Enterprise,Heather Williams; Ilana Blum,2018.0,RAND Corporation,Other,Other,,,,https://doi.org/10.7249/rr1964,,,10.7249/rr1964,,,,,,,,,,False,Standard,OpenAlex,open source intelligence,discovery,90.0,28.0,,3.0,2026-04-25T00:54:24.229093+00:00,40.0,97.74,20.0,0.0,50.0,65.6,,auto-include,Crossref DOI,False,e6c60acfac0d436bb90b37f5043bcfd1
"Open source intelligence, social media and law enforcement: Visions, constraints and critiques",Daniel Trottier,2015.0,European Journal of Cultural Studies,Other,Other,,,,https://doi.org/10.1177/1367549415577396,,,10.1177/1367549415577396,,,,,"This article considers how recent developments in open source intelligence impact the inclusion of social media data in policing, and how these changes are a reflection of technological affordances by platform developers and private third-party companies, as well as police cultural and institutional constraints. It explores the institutional contexts in which social media open source intelligence is trialled in Europe by drawing on interviews with police officials and privacy advocates from 13 European Union member states. Respondents considered their adoption of open source social media monitoring technologies in their jurisdiction, locating this uptake within a context of technological scepticism. While open source intelligence infused with social media data enables an immediate access to social life for investigators, so too do they provoke a preoccupation with the origins and circulations of this content. This tension dovetails with institutional concerns, including a lack of specialised staff, budget constraints, along with a lack of clear legal and procedural protocols.",,,,,False,Standard,OpenAlex,open source intelligence,discovery,55.0,41.0,,7.0,2026-04-25T00:54:24.229093+00:00,40.0,87.22,20.0,0.0,62.5,64.51,,auto-include,Crossref DOI,False,e6c60acfac0d436bb90b37f5043bcfd1
Systematic Literature Review to Investigate the Application of Open Source Intelligence (OSINT) with Artificial Intelligence,João Rafael Gonçalves Evangelista; Renato José Sassi; Márcio Romero; Domingos Napolitano,2020.0,Journal of Applied Security Research,Other,Other,,,,https://doi.org/10.1080/19361610.2020.1761737,,,10.1080/19361610.2020.1761737,,,,,,,,,,False,Standard,OpenAlex,open source intelligence,discovery,66.0,32.0,,8.0,2026-04-25T00:54:24.229093+00:00,40.0,91.11,20.0,0.0,50.0,62.94,,auto-include,Crossref DOI,False,e6c60acfac0d436bb90b37f5043bcfd1
Open Source Intelligence for Malicious Behavior Discovery and Interpretation,Yi-Ting Huang; Chi Yu Lin; Ying-REN Guo; Kai-Chieh Lo; Yeali S. Sun; Meng Chang Chen,2021.0,IEEE Transactions on Dependable and Secure Computing,Other,Other,,,,https://doi.org/10.1109/tdsc.2021.3119008,,,10.1109/tdsc.2021.3119008,,,,,,,,,,False,Standard,OpenAlex,open source intelligence,discovery,36.0,54.0,,14.0,2026-04-25T00:54:24.229093+00:00,100.0,78.24,20.0,0.0,37.5,75.67,,auto-include,Crossref DOI,False,e6c60acfac0d436bb90b37f5043bcfd1
Automating Open Source Intelligence,,2016.0,Elsevier,Other,Other,,,,https://doi.org/10.1016/c2014-0-02170-3,,,10.1016/c2014-0-02170-3,,,,,,,,,,False,Standard,OpenAlex,open source intelligence,discovery,27.0,0.0,,18.0,2026-04-25T00:54:24.229093+00:00,100.0,72.2,20.0,0.0,37.5,73.26,,auto-include,Crossref DOI,False,e6c60acfac0d436bb90b37f5043bcfd1
Open Source Intelligence in the Twenty-First Century,Chris Hobbs; Matthew Moran; Daniel Salisbury,2014.0,Palgrave Macmillan UK,Other,Other,,,,https://doi.org/10.1057/9781137353320,,,10.1057/9781137353320,,,,,,,,,,False,Standard,OpenAlex,open source intelligence,discovery,23.0,0.0,,20.0,2026-04-25T00:54:24.229093+00:00,100.0,68.86,20.0,0.0,37.5,71.92,,auto-include,Crossref DOI,False,e6c60acfac0d436bb90b37f5043bcfd1
A survey exploring open source Intelligence for smarter password cracking,Aikaterini Kanta; Iwen Coisel; Mark Scanlon,2020.0,Forensic Science International: Digital Investigation,Other,Other,,,,https://doi.org/10.1016/j.fsidi.2020.301075,,,10.1016/j.fsidi.2020.301075,,,,,,,,,,False,Standard,OpenAlex,open source intelligence,discovery,32.0,182.0,,21.0,2026-04-25T00:54:24.229093+00:00,100.0,75.76,20.0,0.0,37.5,74.68,,auto-include,Crossref DOI,False,e6c60acfac0d436bb90b37f5043bcfd1
"The Not Yet Exploited Goldmine of OSINT: Opportunities, Open Challenges and Future Trends",Javier Pastor-Galindo; Pantaleone Nespoli; Felix Gomez Marmol; Gregorio Martinez Perez,2020.0,IEEE Access,Other,Other,,,,https://doi.org/10.1109/access.2020.2965257,,,10.1109/access.2020.2965257,,,,,,,,,,False,Standard,OpenAlex,OSINT methodology,discovery,151.0,97.0,,52.0,2026-04-25T00:54:24.229093+00:00,100.0,100.0,20.0,0.0,25.0,81.25,,auto-include,Crossref DOI,False,e6c60acfac0d436bb90b37f5043bcfd1
Using open source data in developing competitive and marketing intelligence,Craig S. Fleisher,2008.0,European Journal of Marketing,Other,Other,,,,https://doi.org/10.1108/03090560810877196,,,10.1108/03090560810877196,,,,,"Purpose The paper seeks to show how the increasingly popular use of data and information acquired from open sources (OS) impacts competitive and marketing intelligence (C/MI). It describes the current state of the art in analysis efforts of open source intelligence (OSINT) in business/commercial enterprises, examines the planning and execution challenges organizations are experiencing associated with effectively using and fusing OSINT in C/MI decision‐making processes, and provides guidelines associated with the successful use of OSINT. Design/methodology/approach This is a descriptive, conceptual paper that utilizes and develops arguments based on the search of three unclassified bodies of literature in competitive and marketing intelligence, intelligence processing and marketing analysis. Findings Open sources are useful in marketing analyses because they can be easily accessible, inexpensive, quickly accessed and voluminous in availability. There are several conceptual and practical challenges the analyst faces in employing them. These can be addressed through awareness of these issues as well as a willingness to invest resources into studying how to improve the data gathering/analysis interface. Practical implications Marketing analysts increasingly rely on open sources of data in developing plans, strategy and tactics. This article provides a description of the challenges they face in utilizing this data, as well as provides a discussion of the effective practices that some organizations have demonstrated in applying and fusing open sources in their C/MI analysis process. Originality/value There are very few papers published focusing on applying OSINT in enterprises for competitive and marketing intelligence purposes. More uniquely, this paper is written from the perspective of the marketing analyst and how they use open source data in the competitive and marketing sense‐making process and not the perspective of individuals specialized in gathering these data.",,,,,False,Standard,OpenAlex,OSINT methodology,discovery,115.0,48.0,,55.0,2026-04-25T00:54:24.229093+00:00,40.0,100.0,20.0,0.0,62.5,69.62,,auto-include,Crossref DOI,False,e6c60acfac0d436bb90b37f5043bcfd1
Cyber Intelligence and OSINT: Developing Mitigation Techniques Against Cybercrime Threats on Social Media,Abel Yeboah-Ofori; ,2018.0,International Journal of Cyber-Security and Digital Forensics,Other,Other,,,,https://doi.org/10.17781/p002378,,,10.17781/p002378,,,,,,,,,,False,Standard,OpenAlex,OSINT methodology,discovery,26.0,9.0,,69.0,2026-04-25T00:54:24.229093+00:00,40.0,71.41,20.0,0.0,100.0,67.57,,auto-include,Crossref DOI,False,e6c60acfac0d436bb90b37f5043bcfd1
Becoming JUDAS: Correlating Users and Devices During a Digital Investigation,Ana Nieto,2020.0,IEEE Transactions on Information Forensics and Security,Other,Other,,,,https://doi.org/10.1109/tifs.2020.2988602,,,10.1109/tifs.2020.2988602,,,,,,,,,,False,Standard,OpenAlex,OSINT methodology,discovery,13.0,8.0,,70.0,2026-04-25T00:54:24.229093+00:00,100.0,57.18,20.0,0.0,25.0,64.12,,auto-include,Crossref DOI,False,e6c60acfac0d436bb90b37f5043bcfd1
"Infodemiology and Infoveillance: Framework for an Emerging Set of Public Health Informatics Methods to Analyze Search, Communication and Publication Behavior on the Internet",Gunther Eysenbach,2009.0,Journal of Medical Internet Research,Other,Other,,,,https://doi.org/10.2196/jmir.1157,,,10.2196/jmir.1157,,,,,,,,,,True,Standard,OpenAlex,OSINT methodology,discovery,1399.0,13.0,,73.0,2026-04-25T00:54:24.229093+00:00,40.0,100.0,20.0,0.0,25.0,60.25,,auto-include,Crossref DOI,False,e6c60acfac0d436bb90b37f5043bcfd1
OSINT Research Studios: A Flexible Crowdsourcing Framework to Scale Up Open Source Intelligence Investigations,Anirban Mukhopadhyay; Sukrit Venkatagiri; Kurt Luther,2024.0,Proceedings of the ACM on Human-Computer Interaction,Other,Other,,,,https://doi.org/10.1145/3637382,,,10.1145/3637382,,,,,"Open Source Intelligence (OSINT) investigations, which rely entirely on publicly available data such as social media, play an increasingly important role in solving crimes and holding governments accountable. The growing volume of data and complex nature of tasks, however, means there is a pressing need to scale and speed up OSINT investigations. Expert-led crowdsourcing approaches show promise, but tend to either focus on narrow tasks or domains, or require resource-intense, long-term relationships between expert investigators and crowds. We address this gap by providing a flexible framework that enables investigators across domains to enlist crowdsourced support for discovery and verification of OSINT. We use a design-based research (DBR) approach to develop OSINT Research Studios (ORS), a sociotechnical system in which novice crowds are trained to support professional investigators with complex OSINT investigations. Through our qualitative evaluation, we found that ORS facilitates ethical and effective OSINT investigations across multiple domains. We also discuss broader implications of expert-crowd collaboration and opportunities for future work.",,,,,False,Standard,OpenAlex,OSINT investigation,discovery,3.0,75.0,,126.0,2026-04-25T00:54:24.229093+00:00,100.0,30.04,20.0,0.0,100.0,72.02,,auto-include,Crossref DOI,False,e6c60acfac0d436bb90b37f5043bcfd1
A quantitative study of the law enforcement in using open source intelligence techniques through undergraduate practical training,Ole Halvar Larsen; Hung Q. Ngo; Nhien-An Le-Khac,2023.0,Forensic Science International: Digital Investigation,Other,Other,,,,https://doi.org/10.1016/j.fsidi.2023.301622,,,10.1016/j.fsidi.2023.301622,,,,,,,,,,False,Standard,OpenAlex,OSINT investigation,discovery,9.0,15.0,,132.0,2026-04-25T00:54:24.229093+00:00,100.0,49.89,20.0,0.0,50.0,67.46,,auto-include,Crossref DOI,False,e6c60acfac0d436bb90b37f5043bcfd1
Robust Botnet DGA Detection: Blending XAI and OSINT for Cyber Threat Intelligence Sharing,Hatma Suryotrisongko; Yasuo Musashi; Akio Tsuneda; Kenichi Sugitani,2022.0,IEEE Access,Other,Other,,,,https://doi.org/10.1109/access.2022.3162588,,,10.1109/access.2022.3162588,,,,,,,,,,False,Standard,OpenAlex,OSINT investigation,discovery,79.0,59.0,,133.0,2026-04-25T00:54:24.229093+00:00,100.0,94.95,20.0,0.0,37.5,82.35,,auto-include,Crossref DOI,False,e6c60acfac0d436bb90b37f5043bcfd1
Introducing Social Media Intelligence (SOCMINT),David Omand; Jamie Bartlett; Carl Miller,2012.0,Intelligence and National Security,Other,Other,,,,https://doi.org/10.1080/02684527.2012.716965,,,10.1080/02684527.2012.716965,,,,,,,,,,False,Standard,OpenAlex,social media intelligence,discovery,132.0,0.0,,147.0,2026-04-25T00:54:24.229093+00:00,100.0,100.0,20.0,0.0,37.5,84.38,,auto-include,Crossref DOI,False,e6c60acfac0d436bb90b37f5043bcfd1
Comparing Physician and Artificial Intelligence Chatbot Responses to Patient Questions Posted to a Public Social Media Forum,John W. Ayers; Adam Poliak; Mark Dredze; Eric C. Leas; Zechariah Zhu; Jessica B. Kelley; Dennis J. Faix; Aaron M. Goodman; Christopher A. Longhurst; Michael Hogarth; Davey M. Smith,2023.0,JAMA Internal Medicine,Other,Other,,,,https://doi.org/10.1001/jamainternmed.2023.1838,,,10.1001/jamainternmed.2023.1838,,,,,"Importance The rapid expansion of virtual health care has caused a surge in patient messages concomitant with more work and burnout among health care professionals. Artificial intelligence (AI) assistants could potentially aid in creating answers to patient questions by drafting responses that could be reviewed by clinicians. Objective To evaluate the ability of an AI chatbot assistant (ChatGPT), released in November 2022, to provide quality and empathetic responses to patient questions. Design, Setting, and Participants In this cross-sectional study, a public and nonidentifiable database of questions from a public social media forum (Reddit’s r/AskDocs) was used to randomly draw 195 exchanges from October 2022 where a verified physician responded to a public question. Chatbot responses were generated by entering the original question into a fresh session (without prior questions having been asked in the session) on December 22 and 23, 2022. The original question along with anonymized and randomly ordered physician and chatbot responses were evaluated in triplicate by a team of licensed health care professionals. Evaluators chose “which response was better” and judged both “the quality of information provided” ( very poor , poor , acceptable , good , or very good ) and “the empathy or bedside manner provided” ( not empathetic , slightly empathetic , moderately empathetic , empathetic , and very empathetic ). Mean outcomes were ordered on a 1 to 5 scale and compared between chatbot and physicians. Results Of the 195 questions and responses, evaluators preferred chatbot responses to physician responses in 78.6% (95% CI, 75.0%-81.8%) of the 585 evaluations. Mean (IQR) physician responses were significantly shorter than chatbot responses (52 [17-62] words vs 211 [168-245] words; t = 25.4; P &amp;lt; .001). Chatbot responses were rated of significantly higher quality than physician responses ( t = 13.3; P &amp;lt; .001). The proportion of responses rated as good or very good quality (≥ 4), for instance, was higher for chatbot than physicians (chatbot: 78.5%, 95% CI, 72.3%-84.1%; physicians: 22.1%, 95% CI, 16.4%-28.2%;). This amounted to 3.6 times higher prevalence of good or very good quality responses for the chatbot. Chatbot responses were also rated significantly more empathetic than physician responses ( t = 18.9; P &amp;lt; .001). The proportion of responses rated empathetic or very empathetic (≥4) was higher for chatbot than for physicians (physicians: 4.6%, 95% CI, 2.1%-7.7%; chatbot: 45.1%, 95% CI, 38.5%-51.8%; physicians: 4.6%, 95% CI, 2.1%-7.7%). This amounted to 9.8 times higher prevalence of empathetic or very empathetic responses for the chatbot. Conclusions In this cross-sectional study, a chatbot generated quality and empathetic responses to patient questions posed in an online forum. Further exploration of this technology is warranted in clinical settings, such as using chatbot to draft responses that physicians could then edit. Randomized trials could assess further if using AI assistants might improve responses, lower clinician burnout, and improve patient outcomes.",,,,,True,Standard,OpenAlex,social media intelligence,discovery,2149.0,19.0,,148.0,2026-04-25T00:54:24.229093+00:00,40.0,100.0,20.0,0.0,50.0,66.5,,auto-include,Crossref DOI,False,e6c60acfac0d436bb90b37f5043bcfd1
Social Media Analytics and Intelligence,Daniel Zeng; Hsinchun Chen; Robert Lusch; Shu-Hsing Li,2010.0,IEEE Intelligent Systems,Other,Other,,,,https://doi.org/10.1109/mis.2010.151,,,10.1109/mis.2010.151,,,,,,,,,,True,Standard,OpenAlex,social media intelligence,discovery,579.0,0.0,,150.0,2026-04-25T00:54:24.229093+00:00,100.0,100.0,20.0,0.0,37.5,84.38,,auto-include,Crossref DOI,False,e6c60acfac0d436bb90b37f5043bcfd1
Community Intelligence and Social Media Services: A Rumor Theoretic Analysis of Tweets During Social Crises1,Onook Oh; Manish Agrawal; H. Raghav Rao,2013.0,MIS Quarterly,Other,Other,,,,https://doi.org/10.25300/misq/2013/37.2.05,,,10.25300/misq/2013/37.2.05,,,,,"Recent extreme events show that Twitter, a micro-blogging service, is emerging as the dominant social reporting tool to spread information on social crises. It is elevating the online public community to the status of first responders who can collectively cope with social crises. However, at the same time, many warnings have been raised about the reliability of community intelligence obtained through social reporting by the amateur online community. Using rumor theory, this paper studies citizen-driven information processing through Twitter services using data from three social crises: the Mumbai terrorist attacks in 2008, the Toyota recall in 2010, and the Seattle café shooting incident in 2012. We approach social crises as communal efforts for community intelligence gathering and collective information processing to cope with and adapt to uncertain external situations. We explore two issues: (1) collective social reporting as an information processing mechanism to address crisis problems and gather community intelligence, and (2) the degeneration of social reporting into collective rumor mills. Our analysis reveals that information with no clear source provided was the most important, personal involvement next in importance, and anxiety the least yet still important rumor causing factor on Twitter under social crisis situations.",,,,,True,Standard,OpenAlex,social media intelligence,discovery,644.0,63.0,,151.0,2026-04-25T00:54:24.229093+00:00,40.0,100.0,20.0,0.0,75.0,72.75,,auto-include,Crossref DOI,False,e6c60acfac0d436bb90b37f5043bcfd1
Applying Social Media Intelligence for Predicting and Identifying On-line Radicalization and Civil Unrest Oriented Threats,Swati Agarwal; Ashish Sureka,2015.0,arXiv (Cornell University),Other,Other,,,,http://arxiv.org/abs/1511.06858,,,10.48550/arxiv.1511.06858,,,,,,,,,,False,Standard,OpenAlex,social media intelligence,discovery,47.0,76.0,,154.0,2026-04-25T00:54:24.229093+00:00,40.0,83.88,20.0,0.0,62.5,63.18,,auto-include,,False,e6c60acfac0d436bb90b37f5043bcfd1
Fake news detection within online social media using supervised artificial intelligence algorithms,Feyza Altunbey Ozbay; Bilal Alatas,2019.0,Physica A: Statistical Mechanics and its Applications,Other,Other,,,,https://doi.org/10.1016/j.physa.2019.123174,,,10.1016/j.physa.2019.123174,,,,,,,,,,False,Standard,OpenAlex,social media intelligence,discovery,390.0,75.0,,155.0,2026-04-25T00:54:24.229093+00:00,40.0,100.0,20.0,0.0,50.0,66.5,,auto-include,Crossref DOI,False,e6c60acfac0d436bb90b37f5043bcfd1
Sentiment Analysis in Social Media Data for Depression Detection Using Artificial Intelligence: A Review,Nirmal Varghese Babu; E. Grace Mary Kanaga,2021.0,SN Computer Science,Other,Other,,,,https://doi.org/10.1007/s42979-021-00958-1,,,10.1007/s42979-021-00958-1,,,,,,,,,,False,Standard,OpenAlex,social media intelligence,discovery,287.0,102.0,,156.0,2026-04-25T00:54:24.229093+00:00,40.0,100.0,20.0,0.0,37.5,63.38,,auto-include,Crossref DOI,False,e6c60acfac0d436bb90b37f5043bcfd1
Understanding artificial intelligence adoption in operations management: insights from the review of academic literature and social media discussions,Purva Grover; Arpan Kumar Kar; Yogesh K. Dwivedi,2020.0,Annals of Operations Research,Other,Other,,,,https://doi.org/10.1007/s10479-020-03683-9,,,10.1007/s10479-020-03683-9,,,,,,,,,,False,Standard,OpenAlex,social media intelligence,discovery,390.0,104.0,,163.0,2026-04-25T00:54:24.229093+00:00,40.0,100.0,20.0,0.0,37.5,63.38,,auto-include,Crossref DOI,False,e6c60acfac0d436bb90b37f5043bcfd1
